Id,Name,Rarity,AmuletType,MinHp,MaxHp,MinAtk,MaxAtk,BaseId,VariationId,Abilities11,Abilities12,Abilities13,Abilities21,Abilities22,Abilities23,Abilities31,Abilities32,Abilities33,CvInfo,Text1,Text2,Text3,Text4,Text5,LimitBreakId,IsPlayable,SellCoin,SellDewPoint,IsHideChangeImage
40040057,狂风呼啸,4,1,21,140,7,52,400379,1,7,400,8,397,398,399,0,0,0,AMULET_ARTIST_40040057,狂风呼啸，响彻荒野。\n暴风如利刃，\n仿佛要摧毁山峰般发出低吼。\n炎天之地不留残影，\n飞驰而过的是伐由——暴风的化身。,为狂风呼啸而生，\n时时刻刻与风同在。\n伐由呼啸而去刮遍世界，\n不知薄暮宵夕为何物。,月光之下风现寒光，\n劈开柔和的夜雾，\n沐浴其中的，是锋利的爪刃。\n伤害着一切事物，\n只为作为风而存在。,孤独的伐由旅途漫漫，\n所行之路没有尽头。\n然而他只是一味飞奔，\n因为那是疾风龙的骄傲。,流浪的终点究竟会走向何方？\n是苍穹之巅，还是大地尽头。\n无需还乡，亦无需故乡。\n呼啸、怒吼、歌唱，其名为伐由。\n飞驰而过的，暴风化身。,10000,1,2000,1000,0
40040058,幽美的虚无,4,1,21,141,7,51,400381,1,210000103,210000104,210000105,110090002,110090003,110090004,0,0,0,AMULET_ARTIST_40040058,“黑暗魔力”——\n能使高贵的龙也陷入疯狂的魔性力量。\n被昏暗之力支配的她露出了渗人的笑容。\n“呵呵……狂乱之宴……开始吧。\n那充满悲愤与憎恶的破灭之宴……”,她所降临之处，\n转瞬之间便会充满恐惧和混乱。\n听到人们的哀嚎与叹息，她愉悦地喊道：\n“困惑吧、畏惧吧、颤抖吧，人类。\n你们的痛苦……是唯一能取悦我的东西！”,面对性情大变的圣骑士的暴行，\n人们终于拿起了手中的武器。\n他们的猛攻让她败下阵来。然而……\n“呵呵……太棒了。正是这份憎恶，\n将给我带来更强大的力量！”,她站起身，曾经赋予人们勇气的圣旗\n燃起了新的战火。\n其身姿剥夺了人们抵抗的力量。\n“不错，就是这个表情。悲惨地祈祷吧，\n那根本无法传达的愿望……”,人们即使受伤死去，也依旧在祈祷——\n啊，谁来把她从“黑暗魔力”中解救出来吧。\n她不屑一顾地冷眼旁观……\n“能抵抗我的绝望之人啊，倘若真的存在\n就尽管来讨伐我吧。呵呵呵呵……”,10000,1,2000,1000,0
40040059,白燕骑士团的互补搭档,4,3,21,141,7,51,400385,1,210001101,210001102,210001103,210000602,210000603,210000604,0,0,0,AMULET_ARTIST_40040059,“小偷！别跑！”\n“帕蒂亚，跑那么快很危……”\n咣当！\n“好痛～”\n“晚了一步吗……”,“唉……你只要好好干就能做到，\n为什么总是……”\n“团长～训斥的话等下再说，\n能不能……先帮忙\n把我从这里弄出来呢～”,“痛痛痛……啊，你好呀！\n我们中午才见过呢，老板！\n托您的福，成功抓到小偷了！”\n“竟然会撞进同一家店……”\n“赔、赔偿的钱我会自己出的啦！”,“老板你放心，修理费我会全掏的。\n诶？谢谢我？\n你一直都想重建？\n那么……反而省了修缮资金？”\n“嗯？帕蒂亚，你该不会……”,“之前巡逻的时候偶然听到这里的老板\n说修缮资金不够。刚才跑得太快停不下来，\n想着反正都要撞，不如就撞这家！”\n“果然吗。真是惊人的爆发力，不过……\n下次拜托你别再撞进别人的店了……”,10000,1,2000,1000,0
40040060,假面舞会·歌剧,4,2,22,151,6,41,400388,1,110210503,110210504,110210505,210002102,210002103,210002104,0,0,0,AMULET_ARTIST_40040060,“这次的工作是捕获在假面舞会上\n与贵族进行幕后交易的黑市商人。”\n“戴着假面潜入吗，有点紧张啊。\n威克，沙音，你们两个呢？”\n“安静点，埃里克。发现目标了。”,“等等，目标旁边有位小姐。\n得先把她引开才行。”\n“唔～她大概是认识的人……\n沙音，你能替我们去吗？”\n“没办法……好吧，我去了。”,“小姐，请伸出手。什么？\n你说我很帅但没见过？”\n“啊……不妙啊，威克！\n刚才的对话可能被目标察觉到了！”\n“呃，面具什么的不戴了，直接上！”,“死心吧恶徒们！我是正义的盗贼威克！\n惩奸除恶的时刻到了！”\n“喂……威克，别太亢奋了。”\n“是啊。这里是贵族的社交场所，\n要保持优雅哦？看招！”,“好，将军了。求饶也没用。\n你们就乖乖地去牢里伏法吧。”\n“啊，好累！不过，接下来\n我们也好好享受派对吧。”\n“嗯，你们两个，别忘了戴假面啊！”,10000,1,2000,1000,0
40040061,妖艳的宫廷魔法师,4,2,18,123,4,33,400387,1,110210403,110210404,110210405,110100002,110100003,110100004,0,0,0,AMULET_ARTIST_40040061,醒过来时，我在一个陌生的房间里。\n自称“卡珊德拉”的妖艳魔法师\n一边凝视着我，一边露出笑容。\n“你终于醒了呢。呵呵呵……\n看来新的魔法实验成功了。”,我是谁？为什么会在这里？\n卡珊德拉不顾我的焦急说道：\n“从现在开始要听我的话哦。\n顺便一提，你没有拒绝权。\n因为我是你的亲生母亲。”,我感到害怕，想要逃跑。\n但身体却不能按自己的意志活动。\n“哎呀，坏孩子要接受惩罚呢……”\n魔法师露出冷酷的笑容，伸出魔法之手。\n我发出惨叫，然后……,魔法之手拍打着我身上堆积的灰尘。\n“跟你开玩笑的。你不知道\n自己是动不了的吗？”\n之后被拿去晾晒时我才注意到，\n我不是人类。我是……一本书！,“你是被注入生命的魔法日记。\n名字叫‘卢格烈’。不过，刚才……”\n卡珊德拉哈哈大笑着。\n虽然还有很多事想问，但我发誓……\n这个被嘲笑的仇，我一定要讨回来！,10000,1,2000,100,0
40040062,来自彼岸之物,4,3,21,142,7,50,400390,1,110120007,110120008,110120001,110130002,110130003,110130004,0,0,0,AMULET_ARTIST_40040062,讲讲我村里某个奇妙夜晚发生的事吧。\n那晚，村里唯一的教会传来了钟声。\n“咣……咣……”钟楼传来的钟声\n仿佛在宣告处刑之时的到来。\n那是宣告恐怖之物降临的声音。,那恐怖之物的巨大身躯盘踞着钟楼，\n散发出令人毛骨悚然的淡紫烟雾。\n村民被烟雾所吸引，纷纷神色阴郁地\n从窗户中探出身子开始呻吟。\n此时，一个黑衣男子出现了……,男子拿着奇异的法杖指向恐怖之物，\n那恐怖之物便立刻痛苦地扭动身躯，\n而村民们则呻吟着变成蠢动的触手。\n弥漫的烟雾染上不详的鲜红。\n钟楼随着一声巨响而崩坏。,我亲眼目睹了那景象……你问我在哪\n看到的？是啊……我是在哪里目睹的呢？\n在梦里？不，那不是梦境。\n惊恐的我听到了那恐怖的声音。\n“啊、啊……吾乃……”,对了！当时的我好像\n是那恐怖之物从窗口垂下的触手！\n而那似曾相识的恐怖声音，\n则是从我的口中传出……\n“吾乃暗夜低语者，合于吾，赐汝祝福！”,10000,1,2000,1000,0
40040063,噢啦！乘查理奥托而来！,4,2,22,151,6,41,400392,1,110390003,110390004,110390005,210001201,210001202,210001203,0,0,0,AMULET_ARTIST_40040063,哐当昂昂昂昂昂昂昂昂\n昂昂昂昂昂昂昂昂昂！\n那家伙气势汹汹地踢开了大门。\n“噢啦噢啦噢啦！\n跟我单挑吧！”,“干嘛！？抢了的钱我才不会还！？”\n“我是勇也！你的鸡冠头\n可真大啊！？不过还是没我的大！\n也就是说，我比你更厉害！”\n“你、你到底在说什么！？”,其中一个坏蛋企图\n阻止勇也，然而……\n“呃啊啊啊啊啊啊！？”\n却被狂飙的勇也撞开，\n飞上了天。,咔嚓！咣当！哗啦！\n勇也在狭小的屋子里横冲直撞。\n“嘿！这可真带劲！”\n“啊啊！？我、我的家居然被！？\n连金币也都是伤痕！？”,“怎么样！？服不服！\n是我赢了！”\n“噫！？这种家伙怎么扛得住啊！\n我宁可被抓！\n快去找警卫队求救啊！”,10000,1,2000,1000,0
40040064,毛绒绒乐园,4,2,22,151,6,41,400396,1,613,110020304,110020305,0,0,0,0,0,0,AMULET_ARTIST_40040064,“神威的毛好柔软好暖和～\n真是太舒服啦～”\n“咕噜噜噜……这是我引以为傲的皮毛，\n它能抵御雪原的极寒。\n再靠近点，我来为你驱散夜晚的寒冷。”,“谢啦～呼啊……\n好像有点困了哦。\n从早到晚，一直在钓鱼嘛……”\n“我也是，今天能够尽情狩猎，\n非常开心……”,“哈啊……已经早上了啊～\n不知不觉就睡过去了哦～”\n“你睡得真香啊。\n还觉得累吗，太公望？”,“彻底恢复精神了哦～\n这都是多亏了神威。\n作为感谢，下次我教你钓鱼哦～”\n“钓鱼吗，虽说有兴趣，\n但我没法拿鱼竿啊……”,“没有仙宝办不到的事哦！\n我会用我的仙宝\n想办法让神威也能钓鱼的～”\n“嚯！居然还有那种道具！\n人类真是对各种东西都运用自如呢！”,10000,1,2000,1000,0
40040065,亮晶晶☆闪亮之夜,4,2,22,150,6,42,400394,1,110210103,110210104,110210105,110390002,110390003,110390004,110200007,590,110200008,AMULET_ARTIST_40040065,“小～贞德☆\n怎么穿了这么可爱的一身衣服啊～”\n“呀！？神、神圣菲尼克斯。\n其实……今天是名为星龙祭的\n人类庆典。所以换上了礼服……”,“穿上礼服是要去参加派对吗！？\n我也想去那个庆典♪”\n“嗯，当然没问题。有很多龙\n都会参加圣城举办的星龙祭派对。\n我们一起去庆祝流星之夜吧。”,“哇，亮闪闪的～好热闹啊！”\n“嗯，果然这种欢乐的气氛令人雀跃。\n就今天一天，我也放……”\n“咦？那边好像传来了吵闹的声音。”\n“什么！？今年也出现树精了吗！”,“在大家的星龙祭上作乱的无礼之徒！\n不可饶恕，今夜就由我来制裁你们！”\n“哇，等等！我也要去亮晶晶的\n树精那边～小贞德今天\n看起来格外开心啊♪”,“呼……这下无礼之徒也退散了，\n大家就能安心地享受今天的庆典了吧。”\n“呵呵，你真的很喜欢星龙祭呢。”\n“嗯，你也一定会喜欢上的。\n来，让我们一同庆祝吧！星龙祭快乐！”,10000,1,2000,1000,0
40040066,新年伊始,4,1,21,140,7,52,400408,1,310000503,310000504,310000505,210000102,210000103,210000104,0,0,0,AMULET_ARTIST_40040066,“掌握了日出之国板羽球的玩法\n所以想跟我玩？没问题！”\n“亏你能想出这种主意啊，卢卡。”\n“嘿嘿。我在想，跟你们玩一定\n很有趣！那我们这就开始吧～”,“加～油！你们两个都加油啊♪\n喵哈哈，看来现在加斯特占优势？”\n“呵呵，胜负已分，卢卡。”\n“唔，我可不会让你轻易取胜的！\n接招吧！我的必杀技·新年扣杀！”,“好痛！羽、羽毛戳到脸了……”\n“嘿～嘿～看我先得一分！\n拉拉诺亚，快给他涂上涂上～”\n“好嘞！用笔打个叉，我涂☆”\n“呜……我不会忘记这耻辱的！”,“哈啊……哈啊……总算扳回来了。\n呵、呵呵……下一击要奠定我的胜局！\n我要上了哦！卢卡！”\n“喂喂！你朝哪里打啊！？”\n“哎呀～怎么朝夕阳飞去了呢。”,“因为羽毛都掉光了，比赛到此为止！\n结果……打成了平手！”\n“没能赢你是有点窝火，不过算了。\n看在……大家都这么开心的份上。”\n“对吧！明年也一起玩板羽球吧！”,10000,1,2000,1000,0
40040067,猫猪趣画,4,2,18,122,4,33,400406,1,110210503,110210504,110210505,654,655,656,0,0,0,AMULET_ARTIST_40040067,新春日出之国大战！\n东方阵营是猫龙·惠比寿！\n西方阵营是战龙摩利支天……\n的眷属小猪崽们。此刻，\n赌上彼此尊严的战斗即将打响！,“喵哈哈！这喵小的一群家伙，\n看来战龙的眷属也不怎么样喵！”\n体型的差距一目了然，惠比寿\n充分运用自己庞大的身躯击退小猪崽！\n处于劣势的小猪崽能否迎来逆转之机……,小猪崽们并没有放弃！\n它们一起用脑袋向惠比寿的肚子\n发动了三段突击！气势如同战龙本尊！\n惠比寿也被压制而发出“喵！？”的叫声。\n接下来，两边又会如何出招呢……,惠比寿也不甘示弱！\n反复用自己引以为傲的肉球拳发动攻击！\n但论速度还是小猪崽们更胜一筹！\n看穿了拳头动作的小猪崽们\n再次用脑袋向惠比寿的侧腹发动三段突击！,“喵喵喵！认输了喵！”\n逼急了的老鼠会咬猫，逼急了的小猪\n也能战胜猫！胜利属于小猪崽们！\n就算个头小，不屈不挠便能取得胜利！\n无论对手多么强大，都不要轻言放弃。,10000,1,2000,100,0
40040068,疫病之源,4,1,21,142,7,50,400410,1,110160103,110160104,110160105,0,0,0,0,0,0,AMULET_ARTIST_40040068,疯了？你说我疯了？\n那可真是不胜荣幸……毕竟这话\n可源自笃信自己是正义的家伙……\n但你为什么不明白……你那并不是\n什么正义，而仅仅是因为碰巧受到眷顾！,所谓的受到眷顾就是个祸害……\n让人丝毫察觉不到自己的傲慢，\n将自己与不受眷顾者分为两个世界。\n这样的家伙居然是正义，\n你觉得这样的世界没有疯吗？,弱者是一种病！是强者导致的病！\n是会扩散到全世界的疫病！\n出现疫病的世界就是疯了吧？\n所以才必须拯救这个世界啊。\n必须让这个世界回归正轨啊。,拯救弱者再简单不过了。\n只要没有强者就好了……\n只要强者都死绝，自然就不会再有弱者！\n强者理应感染上名为弱者的疫病！\n也就是说！肃清才是救赎！,受眷顾者理应被肃清。\n受眷顾者理应被传染。\n所以，就由我来感染这世上的强者吧！\n我就是——卢弗·托修卡特尔。\n世界的疫病之源、阿基德的利牙！,10000,1,2000,1000,0
40040069,天空的王者,4,2,18,122,5,34,400415,1,210000203,210000204,210000205,749,7,8,0,0,0,AMULET_ARTIST_40040069,哟，是你啊。\n想打听关于火龙的事？\n热爱学习是好事。\n不过我只知道原来的世界里\n那家伙的情报，姑且讲给你听吧。,火龙……\n在我们的世界里无人不晓的怪物，\n人们惧怕并称其为“天空的王者”。\n那张开巨大的双翼在天空中\n悠然飞翔的身影，正可谓王之风范。,火龙会从嘴里喷出火球。\n其火焰来自被称为火炎袋的内脏器官。\n你说在这个世界里\n也有会喷火的怪物？\n这可真让人感兴趣呢。,与火龙对峙时\n也要小心它脚上的爪子。\n那利爪会分泌出剧毒。\n嗯？有没有什么应对方法？\n那就把我手上的解毒药给你吧。,要是火龙嘴里漏出了火焰，\n说明它已经怒了。\n发怒的火龙会变得更加迅猛，\n还会一直追着对手不放。\n嗯？这叫声……难道是！？,10000,1,2000,100,0
40040070,交给女仆部队吧！,4,4,21,145,7,47,400414,1,110100003,110100004,110100005,210001101,210001102,210001103,0,0,0,AMULET_ARTIST_40040070,诶，想听米罗蒂以前的故事……咦？\n我的故事吗！？我想想。在我漫长的\n见习女仆生涯中，记忆最深刻的\n当属那个拥有100名女仆部队的宅邸。\n在那里我遇到了前辈、同期和后辈……,我的前辈非常温柔。\n每次我冒失犯错，她都会严厉地教训我，\n之后又偷偷地塞给我点心，\n是一位我非常憧憬的眼镜姐姐。战斗本领\n也很高强……我用刀也完全敌不过。,和我同一年加入的是一位时髦的\n森隐族女孩！每次我打碎盘子，\n她都会边发火边帮我收拾残局。\n还有，每天早上都会边说着\n“才不是为了你呢”边帮我编头发！,后辈是一个慢性子的罗卡族女孩。\n她做的饭可好吃了，\n每次我冒失犯错之后，\n她都会悄悄为我做蛋包饭来安慰我呢！\n不知道为什么她很黏我，我可开心了。,在那里的生活真是太快乐了～\n不过后来我还是冒失犯了大错，\n连前辈都没法帮我圆场，我就被解雇了！\n好在从前辈那里听说了圣城而来到这里。\n不知道大家现在还好吗？,10000,1,2000,1000,0
40040071,三叶的启蒙教程,4,1,21,140,7,52,400286,1,310000503,310000504,310000505,110390002,110390003,110390004,776,777,778,AMULET_ARTIST_40040071,“我用刀剑以外的东西切刺身就没成功过。”\n我无意间的一句话，\n让三叶小姐开始了细致的菜刀用法讲解。\n“要想最大限度地活用食材，\n就应该使用专门的菜刀哦，米罗蒂！”,可是，我一拿菜刀手就抖……\n啊啊……我又回想起过去的失败了！\n“米罗蒂，冷静下来。太紧张的话\n会用力过度压坏刺身的。\n别使劲，心态放轻松。”,无论我失败多少次，\n三叶小姐都不厌其烦、热心地鼓励着我。\n我也逐渐冷静了下来……\n“刚才的刀法很不错哦！\n没错，一刀一刀轻轻地切……”,“我还是第一次切得这么好！”\n“呵呵。刀剑是刀剑，菜刀是菜刀……\n只有正确地使用，\n才能保证食材的鲜活！”\n三叶小姐的笑容中充满了对食材的爱。,“话说三叶小姐……你之前用菜刀\n打倒了魔兽，那是正确的用法吗？”\n“那、那是因为……\n它们在我做饭的时候捣乱！我就顺手……\n请你忘了这件事吧！”,10000,1,2000,1000,0
40040072,小小的勇气,4,1,21,140,7,52,400421,1,210000303,210000304,210000305,210000602,210000603,210000604,0,0,0,AMULET_ARTIST_40040072,“好！见识一下我的特训成果吧！”\n听到霍普充满干劲的声音，\n我觉得自己也要努力才行。\n在一旁辅佐他……这便是向往天翼骑士\n而成为教会骑士的霍普交给我的任务。,“可、可不能勉强……自己哦！”\n老实说，看到血还是会害怕……\n但既然被人依靠了就想好好努力。\n但霍普比想象中更来劲地\n不断往前冲……不会有事吧？,“看招！神圣之剑……啊、好痛！？”\n啊啊～果然出事了！\n施放大招的霍普被敌人击中了手臂……\n有点出血！是血！\n不、不行了。突然头晕目眩……,但是，我不能倒在这里！\n霍普还在坚持战斗！\n我也想作为霍普的辅佐，\n完成自己的使命！\n所以我鼓起勇气，举起了法杖……,“去、去吧……仁慈治愈！”\n“啊，多谢治疗！帮大忙了。”\n太、太好了！治疗成功了！\n我是不是也多少派上了一点用场呢？\n不过，还是希望……他别再乱来了！,10000,1,2000,1000,0
40040073,寡妇丽人,4,2,22,151,6,41,400386,1,210001702,210001703,210001704,210001101,210001102,210001103,0,0,0,AMULET_ARTIST_40040073,你已经离去，\n丢下我一个人。\n我一直无法接受这个事实，\n驻足此地无法动弹，\n只能任凭雨滴拍打在脸颊上。,连绵的细雨冷冷地打在身上。\n就这样冷却我的身心，\n让我麻木得什么都感觉不到吧。\n可你留下的剑却让我意识到\n身体尚存的温暖。温热的泪水划过脸颊。,我的内心仍下着瓢泼大雨。\n然而不知不觉间，\n打湿我身体的雨却停了下来。\n我想起了他的话——\n“雨总会停的”。,温暖的阳光，还有感受到温暖的自己\n都是那么可恨。如果说没有不停的雨，\n那我的内心何时会放晴？\n我还能迎来不再哭泣、\n露出笑容的那一天吗？,只要我还活着，\n就无法得到救赎吧。\n因为我根本无法忘记他。\n那么，我得随他而去……\n我独自一人，走在洒满阳光的温暖之路上。,10000,1,2000,1000,0
40040074,我愿永远守护你,4,2,18,122,5,34,400422,1,110020502,110020503,110020504,210001303,210001304,210001305,0,0,0,AMULET_ARTIST_40040074,他憎恨“结社”。\n无论那憎恨之情令他多痛苦，\n他都决不允许自己放弃战斗。\n没有任何人能够阻止他。\n所以，至少我想守护他。,曾被锁链缠住的我一无所有。\n记忆被夺走，甚至不知道自己是谁。\n是他，将那样的我从牢笼中解放出来。\n如今，锁链已不再是束缚着我的工具，\n而是代表了我们之间的牵绊。,“已经没事了。”\n看到他的神情变得柔和，我也放下心来。\n我也一样憎恨“结社”。\n不过，多亏他站在我身前，\n我才没有意气用事。,从他身后看到的世界，美丽而又悲伤。\n为了复仇而不顾一切向前冲的他，\n既可靠又令我感到不安。\n所以我想要陪伴他，\n让他在这悲伤的世界里不用独自前行。,他转过身，用生硬的口吻对我说：\n“你打算跟着我到什么时候？”\n想象到他眼中所映出的世界，我沉默不语。\n看着他重新迈向前方的背影，\n我暗自发誓……绝对不会让他死去。,10000,1,2000,100,0
40040075,堕落之翼,4,1,17,119,5,37,400430,1,7,8,146,110210403,110210404,110210405,0,0,0,AMULET_ARTIST_40040075,“少女啊，让你久等了……”\n残破的教会中，月光照耀下的\n那头龙静静宣告。被女孩\n从“神”的监牢中解放出来的阿撒兹勒\n以截然不同的姿态踏上女神的土地。,纯白之翼被漆黑所玷污，双角断折，\n他已无半分天使的模样。\n但那漆黑的身姿正是他\n坚守自己高贵信念的佐证。阿撒兹勒\n用眼神向少女示意，弹指发出暗号。,瞬间，废弃的教会与监牢\n在烈焰中一同崩塌。\n面对女孩的惊讶，阿撒兹勒冷笑道：\n“这是诀别的火焰。遵从我灵魂的信念，\n于此再次表明反叛‘神’的意志。”,“持有‘炼狱之匙’的少女啊，我们走。\n踏上揭露‘神’之真相的旅途吧！”\n阿撒兹勒说着便牵起少女的手。\n少女大概永远不会忘记他那决绝的神情，\n那被熊熊火焰照亮的笑容……,之后他们的去向，历史上没有记载。\n据说，阿撒兹勒和女孩的意志\n并未消逝，至今仍在某个地方\n得到传承……然而这一切，\n只有“钥匙”和漆黑的堕天使知道。,10000,1,2000,100,0
40040076,一寸光辉,4,1,17,119,5,37,400432,1,210000602,210000603,210000604,110210503,110210504,110210505,0,0,0,AMULET_ARTIST_40040076,“嘿咻……摘到了！\n这桃子很好吃的，美猴王！”\n“嗯，我知道。那是蟠桃吧？”\n“原来你知道啊。不过算了。\n俺帮你也摘一个吧！”,“真好吃～诶，哇啊！树上有猴子……\n疼，别挠俺，疼疼疼！”\n“猴、猴子好像都聚集过来了。\n难道这棵树是猴子的地盘吗！？”\n“快、快跑啊美猴王～”,“呼～好险啊～俺还以为\n这个时间不会被猴子发现的……”\n“啊！？原来你知道那棵树\n是猴子的地盘吗！？真是的……\n我怎么陪你这个恶作剧小鬼……”,“好啦好啦，别这么说嘛。那么，\n接下来去哪里寻找仙宝呢……”\n“喂喂，你还想不想认真找啊。”\n“说得也是……啊哈哈。呼啊～\n俺有点困了……”,再平常不过的日常一幕——\n看到梦境的是人类还是魔兽？\n就算这份友情此刻无形，\n也依旧是可能照进未来的一寸光辉。,10000,1,2000,100,0
40040078,花簪月夜下,4,3,21,141,7,51,400434,1,210003301,210003302,116,210001603,210001604,210001605,0,0,0,AMULET_ARTIST_40040078,“山茶花啊，有件事想拜托你。\n能帮我戴上这个花簪吗？”\n“哎呀，八千代竟然会拜托我，\n真是难得。今天这是怎么了？”\n“还不习惯戴和平时不一样的发饰。”,“真的呢。你平时戴的大朵花就很美，\n但这个发饰也很可爱。”\n“是吗！其实我是觉得这个\n像你戴的花簪一冲动就买了。\n你能这么说我很开心。”,“哎呀……像我的花簪吗？”\n“嗯！我戴上这个和你站在一起，\n是不是像关系很好的朋友？”\n“呵呵。不是‘像’……也许我们已经\n是那种亲密到互相帮戴花簪的朋友。”,“好，戴好了。非常适合你。\n我们戴了成对的花簪呢。”\n“呵呵，多亏你心灵手巧呢。\n和朋友戴成对的，好开心！\n这么美好的夜晚，不吟诗一首吗？”,“好呀。不如我们来连吟？”\n“好！那就从我开始。\n‘人海两相逢，月映花更红……’”\n“——‘见证知己缘，盟约许花前。’\n呵呵……真是个美好的夜晚呢，八千代。”,10000,1,2000,1000,0
