Id,Name,Rarity,AmuletType,MinHp,MaxHp,MinAtk,MaxAtk,BaseId,VariationId,Abilities11,Abilities12,Abilities13,Abilities21,Abilities22,Abilities23,Abilities31,Abilities32,Abilities33,CvInfo,Text1,Text2,Text3,Text4,Text5,LimitBreakId,IsPlayable,SellCoin,SellDewPoint,IsHideChangeImage
40040009,王之威严,4,2,22,151,6,41,400041,1,110020702,110020703,110020704,110220002,165,110220003,0,0,0,AMULET_ARTIST_40040009,阿尔贝里亚王国·国王亚罗拉斯。\n这位稀世名君率领着家臣，\n毅然望向前方。\n映在他眼中的究竟是何物……,王的道路，绝非一帆风顺。\n怀揣远大理想指引民众，\n最终获得贤王美称的亚罗拉斯，\n也曾数次陷入困境，\n但每次他都为了应守护之人英勇奋战。,王正思索着将来的路。\n如果继续前进，\n总有一天会到达终点。\n但是王注视着远方，\n没有一丝踌躇。因为……,王有8位出色的子嗣。\n他们都从父亲身上学到了很多，\n与父亲共同撑起了王国。\n他们中的任何一个，\n都拥有值得他托付阿尔贝里亚的资质。,王望着可靠的子女们\n勇往直前的的背影，\n眼中映出光明的未来。\n王直视着前方——\n今天也要向着未来迈进。,10000,1,2000,1000,0
40040010,探求未知,4,2,23,156,5,37,400042,1,110020102,110020103,110020104,110210202,110210203,110210204,0,0,0,AMULET_ARTIST_40040010,那么，今天要做什么实验呢♪\n“谁都能变声”的药之类的，\n也没有什么书记载。\n要是做出来了也许很有趣！,材料有蓝蛞蝓精华、\n颠茄花种子和……\n唔……混入生命之石的粉末，\n应该没问题？,这样思考的时间令人激动。\n谁都不知道所以没有正确答案。\n可以随心所欲地来做。\n为什么人们会因为\n未知而不敢尝试呢？,了解未知事物，\n一点都不可怕。\n我认为继续无知才更可怕。\n我可不想\n因为无知而丢掉性命。,好，完成了！接下来就该找人试试了♪\n嘻嘻嘻！应该会很有趣！\n正因如此，研究未知才让人欲罢不能！\n那么，下次要做什么试验呢♪,10000,1,2000,1000,0
40040011,真不让人省心！,4,4,22,150,6,42,400043,1,110100003,110100004,110100005,110020101,110020102,110020103,0,0,0,AMULET_ARTIST_40040011,卢卡哥哥又把衣服\n弄得这么破破烂烂……\n真不让人省心啊！,那么晚才回来，\n还一声不吭直接睡了……\n这次又去哪里瞎胡闹了啊！\n害人家担心！,一针一针……嗯，这样就行了！\n嘿嘿！弄好了！\n感觉自己的针线活水平又提升了！\n咦！？已经早上了！？,真是的！居然为了给他补衣服\n而熬了一整晚……越想越气！\n不把那个笨蛋哥哥踹起来说几句，\n根本没法消气！\n我说……卢卡哥哥！？,卢卡哥哥真是的……\n说什么“为了在你生日的时候\n送你稀有水果才乱来的”，\n这让人家还怎么生气嘛！\n真是……笨蛋哥哥。,10000,1,2000,1000,0
40040012,撤退吧！,4,2,22,151,6,41,400044,1,210001703,210001704,210001705,110100002,110100003,110100004,0,0,0,AMULET_ARTIST_40040012,【撤退秘诀·其一】\n确保撤退路线！\n假设，在幽深的森林里遭到偷袭……\n此时是否掌握了退路\n就将决定生死。,【撤退秘诀·其二】\n正视敌人的强大！\n勇气不等于莽撞。\n挑战不可战胜的敌人，只会得不偿失。\n不打无谓的战斗！,【撤退秘诀·最后的杀手锏】\n哇！？居然有这么强的敌人……\n完全出乎意料。\n这时候就使出最终手段——撒腿就跑！\n跑个通宵，敌人基本就放弃了！,【撤退秘诀·实践篇】\n呼，跑了好远啊。\n都逃到这里了，没事了……\n这样想的时候，是最危险的！\n切不可大意！退回城里前都是撤退！,【撤退秘诀·后续】\n平安无事跑回城里了！\n那么，最后的秘诀！那就是……休息！\n没有体力怎么跑得掉！\n好了，为了明天的撤退，睡吧！,10000,1,2000,1000,0
40040013,此身成影,4,3,21,141,7,51,400045,1,110090003,110090004,110090005,110080002,110080003,110080004,0,0,0,AMULET_ARTIST_40040013,隐身术——\n消除并隐藏气息的忍术。\n能真正熟练运用的人很少。\n但十郎太就是“影”。\n他能瞒过一切敌人。,月光惨淡的暗夜。\n十郎太从敌方忍者的奇袭下救出主君，\n为掩护主君而甘当诱饵。\n他面不改色地披上布，\n一下子便与风景融为一体。,不知不觉中夜色渐渐泛白。\n敌人始终没能找到十郎太，\n失去了耐心纷纷散去。\n然而……十郎太的战斗并没有结束。\n接下来轮到他行动了。,十郎太目光锐利，\n望着敌人远去的方向。\n他解除了隐身术，\n开始悄无声息地追踪敌人。,十郎太转眼间便追上了敌人。\n他如影子般从敌人死角发动攻击，\n接二连三地击倒敌人。\n没多久便消灭了所有敌人的\n十郎太只是“哼”地发出轻笑。,10000,1,2000,1000,0
40040014,愉悦的生死战,4,1,21,140,7,52,400046,1,210001303,210001304,210001305,110060002,110060003,110060004,0,0,0,AMULET_ARTIST_40040014,就是这个！\n这种赌上性命的紧迫感……\n这才是真正的生死战！\n来吧！\n试着逼在下使出二刀流吧！,呃……居然能伤到在下！\n哈哈！有意思！\n这才是在下追求的战斗！\n接下来该在下出招了！,嗯？竟然已经结束了！\n真是可惜！\n没使出二刀流就赢了！\n哈哈哈！,噢，是新的敌人吗！\n而且这杀气……\n可谓强敌！\n不错！就得这样！\n正好厌倦了那堆虾兵蟹将！,哈哈！热血沸腾！\n一决胜负吧！\n看你能否先接下这一招！\n奥义——“自创·大蛇吐息”！,10000,1,2000,1000,0
40040015,甲胄师的目标,4,2,23,156,5,37,400047,1,210001803,204,210001804,110020101,110020102,110020103,0,0,0,AMULET_ARTIST_40040015,甲胄师马尔卡力求制作最强的铠甲\n而埋首于铠甲的研究。\n“铠甲很难抵挡魔法攻击。\n但是如果能克服这一点，\n就能做出最强的铠甲。”,甲胄师马尔卡力求制作无敌的铠甲，\n无数次进行尝试。\n“铁、钢、青铜……普通的素材不行。\n得去找魔法抗性高的素材才行。”,甲胄师马尔卡力求制作最棒的铠甲，\n苦心钻研后终于找到线索。\n“原来如此，黄金具有很高的魔法抗性！\n这样一来就能做出万能防具了！”,甲胄师马尔卡力求制作终极铠甲，\n不断尝试改良。\n“黄金太重了，要除去不需要的部件，\n减轻重量……唔嗯。”,甲胄师马尔卡力求制作最高杰作，\n终于离目标又近了一步。\n“好！理论上已经无懈可击。\n不过还得测试性能才算完成。\n赶快穿上它去试试……！”,10000,1,2000,1000,0
40040016,研究成果的新魔法,4,1,21,146,6,46,400048,1,210000403,210000404,210000405,110020401,110020402,110020403,0,0,0,AMULET_ARTIST_40040016,这是破解了圣城遗留的\n部分古代魔法痕迹而创造出的魔法。\n能够瞻仰古代智慧，你该感到荣幸！,这个魔法具有划时代的意义！\n完美融合了不同文明的魔法，相得益彰……\n呃，战斗中我又情不自禁地……,哼……你挺厉害的嘛。\n好吧，就破例让你见识下\n我更厉害的研究成果！,展开辅助结界、补充至最大魔力！\n我自创的术式大幅加强了魔法的威力。\n如此高级的术式可不多见哦！,你以为这样就结束了？\n接下来才是我的研究成果里最厉害的！\n足以颠覆魔法常识的历史性发明！\n擦亮眼睛看清楚！研究成果的新魔法！,10000,1,2000,1000,0
40040017,铁匠铺三姐妹,4,1,21,146,6,46,400049,1,210000603,210000604,210000605,110020601,110020602,110020603,0,0,0,AMULET_ARTIST_40040017,哐……哐……铁匠铺里\n有节奏地回响着美妙的声音。\n铁匠铺三姐妹——\n大姐雷吉娜、二姐罗吉娜和小妹卢吉娜\n正合力锻造武器。,落落大方但生起气来\n很可怕的大姐——雷吉娜。\n富有专业精神、可靠的二姐——罗吉娜。\n性格开朗、爱幻想\n又备受宠爱的小妹——卢吉娜。,在三姐妹的完美配合下，\n武器逐渐成型。\n三姐妹娴熟的手法，\n跟几十年的老工匠相比也毫不逊色。,“罗吉娜，状态不错啊♪\n看来这次能打造出相当不错的武器呢。”\n“嗯，再加把劲一口气完成吧！”\n“那么，差不多该我表现了！\n让你们见识下天才般的冷却手法！”,尽管是性格迥异的三姐妹，\n但她们在铺子里时齐心协力。\n要打造出媲美伟大铁匠父亲的武器\n——大家怀着这份心情，\n终于打造出了一把顶级武器。,10000,1,2000,1000,0
40040018,舞林大会！,4,3,22,147,6,45,400050,1,310000503,310000504,310000505,110210402,110210403,110210404,0,0,0,AMULET_ARTIST_40040018,嘿！嘿！大家玩得尽兴吗？\n哎呀，来了一位贵宾！\n冰魔法可真酷啊！\n来，一起跳舞吧！,嘿！造出了冰道，在滑冰吗？\n你的舞蹈真有趣！\n不过我可不会输！\n好！加快节奏！,嘿！一不留神已经这个时间了！\n不过，不用你说我也知道！\n你的热情也停不下来吧？\n那就一起跳个通宵吧！,嘿！你也听到了吧？\n看了我们的舞蹈，\n观众们热血沸腾的欢呼！\n耶！让气氛再热烈点吧！,嘿！嘿！\n我们都嗨到极致了呢！\n点燃激情！\n收尾也要干净利落哦？\n让我们开始最后一支舞！,10000,1,2000,1000,0
40040019,战场上的两人,4,1,21,140,7,52,400051,1,210000703,210000704,210000705,110060002,110060003,110060004,0,0,0,AMULET_ARTIST_40040019,“被敌人包围了。\n喂，贝尔扎克，怎么办？”\n“明知故问？\n答案明摆着啊……格杀勿论！”\n“你这家伙还是那么血气方刚啊。”,“呃！利用烟尘趁乱突袭，\n净耍些小聪明！你那边怎么样？”\n“哈哈哈！乐在其中啊！\n你身后就放心交给我吧！”\n“那真是可靠！拜托了！”,“敌人变多了……\n贝尔扎克，你还能打么？”\n“说什么傻话！好戏才刚刚开始！\n形势越不利，才越有趣啊！”\n“哈哈……算我白问了。”,“啧，没完没了……\n说起来佣兵时代也有过这种情况啊。”\n“是啊，兰扎卜。\n那时我们都是菜鸟，最后怎么样了？”\n“回去之后慢慢回想吧。”,“接招！吃我一击！”\n“想赢我们还早了一百年！\n对吧，兰扎卜？”\n“是啊！我们可是身经百战的佣兵！\n想活命的赶紧退散！”,10000,1,2000,1000,0
40040020,昔日幸福,4,1,21,141,7,51,400069,1,210000403,210000404,210000405,110010402,110010403,110010404,0,0,0,AMULET_ARTIST_40040020,“哥哥，这样逃出城堡\n真的没问题吗……”\n“没事。因为偶尔也想悠闲地\n和塞西娅一起出来散散心嘛。”,“塞西娅！这朵花怎么样？”\n“塞西娅在收集花吗。\n色彩斑斓，好漂亮。”\n“呵呵，是啊。\n收集了好多，这样一来……”,“原来如此，是花冠啊。\n看起来很衬塞西娅。”\n“谢谢哥哥！\n不过这花冠是给哥哥做的。\n只有将来成为王的人，才能戴冠。”,“咦？花冠，是给我的？\n谢谢你们两个，我很开心。”\n“哇！像花之国的国王一样呢！”\n“好期待哥哥将来\n真正成为王的那一天啊！”,“等我真正成为王、吗……\n那我想要创造一个和平的国家，\n可以永远拥有这样幸福的时光。”\n“听起来很不错呢！”\n“嗯！我也是！想要那样的国家！”,10000,1,2000,1000,0
40040021,圣骑士的守护,4,2,18,122,4,33,400053,1,110020201,110020202,110020203,110120006,110120007,110120008,0,0,0,AMULET_ARTIST_40040021,已经不行了……\n正这么想时，有人保护了自己。\n休贝尔难以置信地\n注视着那背影。,圣骑士挡在了休贝尔身前。\n能感受到她保护同伴的决心。\n然而休贝尔却脱口而出：\n“不行，快跑……”,战况极度不利。\n但圣骑士仍坚定地说道：\n“我一定会保护你！”\n从她充满勇气的话中，\n休贝尔理解了她为什么会被选为圣骑士。,圣骑士的气势\n逼得敌人连连后退……\n她没有错过这个机会，\n用圣枪扫清一切威胁……,战局逆转……圣骑士获得了最终的胜利。\n休贝尔一生都难以忘记，\n挺身而出守护伙伴的\n勇敢圣骑士的身影。,10000,1,2000,100,0
40040022,为了成为强大的男人,4,4,21,145,7,47,400054,1,110100003,110100004,110100005,110010402,110010403,110010404,0,0,0,AMULET_ARTIST_40040022,“说起来，你们关系很好吧？”\n“不，一点也不好。”\n“咦！？为了让里卡多克服弱点，\n你们通力合作，我还以为关系很好呢。\n那你们到底是什么关系……”,“我和爱德华只是偶尔聊几句，\n仅此而已。”\n“对，看不下去所以稍微给点建议。\n仅此而已。”\n“你们倒是婉转一点啊！”,“被训斥几句也是没办法的事。\n我一定要变强。所以……”\n“来，给你铁棒！”\n“变强是指物理上的！？”,“有人肯为我提出建议，\n其实就是对我最大的帮助……”\n“对，就像这铁棒一样！”\n“哈哈……一点都不好笑！”,“唉……我已经无力吐槽……”\n“霍普，还有力气站着吗？”\n“要用这根铁棒撑一会儿吗？”\n“你们两个，其实关系超好吧！？”,10000,1,2000,1000,0
40040023,五龙之咆哮：耶梦加得,4,2,19,127,4,30,400055,1,110250201,171,110250202,110210302,168,110210303,0,0,0,AMULET_ARTIST_40040023,远古时代，诸龙为对抗邪恶势力\n聚集到一位主人麾下。\n碧龙耶梦加得——\n因其知识渊博、性格公正而闻名，\n受到诸龙崇敬。,碧龙最初追随人类主人时，\n其他龙嘲笑了他。\n“为什么听命于人类这种弱小的生物？\n这岂不是失去了龙\n身为世界统治者的尊严？”,“只相信自己的信念。”\n面对其他龙的嘲笑，\n碧龙高声咆哮道。\n与主人共同创造理想世界……\n这便是碧龙唯一的信念。,碧龙和主人只遵从自己的信念，\n不断对抗邪恶的魔兽。\n诸龙逐渐被他们的真挚信念所吸引，\n也纷纷聚集到那位主人的身边，\n从此再也没有谁嘲笑碧龙。,碧龙战胜邪恶势力后，\n作为主人最初的契约龙备受称赞，\n但碧龙却不为所动。\n他的心境依旧如初——\n“只相信自己的信念”。,10000,1,2000,100,0
40040024,五龙之咆哮：墨丘利,4,2,19,127,4,30,400056,1,110270401,172,110270402,110210202,167,110210203,0,0,0,AMULET_ARTIST_40040024,远古时代，诸龙为对抗邪恶势力\n聚集到一位主人麾下。\n青龙墨丘利——\n用伟大的慈爱和温情呵护同伴，\n治愈战斗的伤痛。,在与邪恶势力的斗争中，\n善良的青龙挺身而出，\n保护了诸龙和人类。\n但不管她再怎么努力，\n依旧有许多人在残酷的战斗中殒命。,战争结束后，\n青龙为了告慰同伴，\n在泉水边献上祈祷。\n春去冬来，岁月流逝，\n青龙依旧心无旁骛地祈祷着。,青龙祈祷的某个夜晚，\n无数道光降临于泉水边。\n那是战争中逝去的灵魂。\n无数道光围着青龙起舞的景象，\n据说美得令人窒息。,在这“青龙之泉”，每年都会有一天，\n无数道光从空中降临。\n相传那是战争中逝去的灵魂\n为告慰了自己的青龙\n而聚集于此，翩翩起舞。,10000,1,2000,100,0
40040025,五龙之咆哮：布伦希尔德,4,2,19,127,4,30,400057,1,110290601,173,110290602,110210102,166,110210103,0,0,0,AMULET_ARTIST_40040025,远古时代，诸龙为对抗邪恶势力\n聚集到一位主人麾下。\n绯龙布伦希尔德——\n她用熔岩般的热情鼓舞同伴，\n用熊熊烈火吞噬敌人。,数百年前，大量魔兽袭击了\n绯龙居住的阿德拉火山。\n绯龙为保护生养自己的火山，\n只身迎击魔兽，\n但寡不敌众，陷入苦战。,此时，一位男子出现在\n遍体鳞伤的绯龙面前。\n“高贵的绯龙啊，我与你共进退！”\n绯龙在他的激励下奋起反击，\n与男子一同赶跑了大群魔兽。,战斗过后，男子向绯龙伸出手，\n未与人类有过接触的绯龙发出恫吓，\n但男子仍毫无惧色地伸着手。\n最终，绯龙拗不过男子，\n第一次接受了人类。,第一次触到的人类的手\n温暖得令她上瘾。\n绯龙与他并肩作战，却不曾缔结契约。\n她遇到自己的命中注定之人，\n则是数百年后的事了。,10000,1,2000,100,0
40040026,五龙之咆哮：朱庇特,4,2,19,127,4,30,400058,1,110310801,174,110310802,110210402,169,110210403,0,0,0,AMULET_ARTIST_40040026,远古时代，诸龙为对抗邪恶势力\n聚集到一位主人麾下。\n辉龙朱庇特——\n在天空中尽情翱翔干扰敌人，\n用全身放出的雷光击退敌人。,辉龙虽和人类主人缔结了契约，\n却还是随心所欲，\n完全没有要听从主人的意思。\n尊敬主人的诸龙指责辉龙狂妄，\n想把他从同伴中除名。,而主人的话却出乎意料。\n“朱庇特，没有什么可以束缚你，\n随心所欲地在天空中翱翔吧！”\n辉龙听到后十分高兴。\n这是第一次有人肯定他的奔放。,辉龙听从主人的话，\n随心所欲地翱翔、放出雷光，\n无拘无束地度日。\n回想起来，这也是他\n第一次听从他人的话。,对抗邪恶势力时，\n辉龙以神出鬼没的动作戏弄敌人，\n多次救主人于危难之中。\n主人让辉龙的个性得到充分发挥，\n因此才能战胜邪恶势力。,10000,1,2000,100,0
40040027,五龙之咆哮：佐迪亚克,4,2,19,127,4,30,400059,1,110331001,175,110331002,110210502,170,110210503,0,0,0,AMULET_ARTIST_40040027,远古时代，诸龙为对抗邪恶势力\n聚集到一位主人麾下。\n暗龙佐迪亚克——\n运用暗之魔力创造出暗影，\n将敌人拖入无尽的黑暗。,暗龙在幽深的洞穴中\n孤独地度过了漫长的岁月。\n因为不光是人类，\n龙也害怕暗龙腐朽的身体，\n都不愿和他一起生活。,某一天，一位男子来到洞穴。\n看到暗龙腐朽的躯体后，\n他毫不畏惧地说道：\n“暗龙啊，离开这个洞穴，\n与我共同踏上无尽的大地吧！”,暗龙不由分说地拒绝了。\n他认为自己一生都该待在暗影之中。\n然而男子看着暗龙的眼睛说道：\n“我想创造一个像你一样\n活在暗影中的生命也能昂首挺胸的世界！”,对于一直生活在暗影中的暗龙来说，\n男子的理想实在过于耀眼。\n但暗龙仍想在他的理想上赌一把。\n据说暗龙在男子的引导下离开幽深洞穴后，\n作为契约龙为支持他的理想鞠躬尽瘁。,10000,1,2000,100,0
40040028,致命佳丽,4,1,21,140,7,52,400060,1,110070003,110070004,110070005,110390002,110390003,110390004,0,0,0,AMULET_ARTIST_40040028,幽深的森林里，\n一位少女和父母走散，嚎啕大哭。\n面对送上门的猎物，\n魔兽们蠢蠢欲动，这时……\n两位美丽的女战士挺身而出。,“小姑娘，你为什么哭？”\n“这样哭的话，\n会被魔兽吃掉哦！”\n女战士们熟练地挥舞着武器，\n压制着魔兽。,看到了女战士们战斗的英姿，\n少女忘记了哭泣，高声喊道：\n“大姐姐们，加油啊！”\n听到少女的声援，\n女战士们的攻势更盛了。,“让它们见识下我们的厉害，伊汉娜！”\n“哈哈哈！正合我意！\n要上了哦！凡妮莎！”\n两人紧握武器，蓄势待发。\n魔兽畏惧了……,女战士们面带笑容挥舞武器，\n打倒魔兽，拯救了少女。\n从此，少女有了梦想。\n——要成为女战士。\n少女收起眼泪，踏上了追梦之路。,10000,1,2000,1000,0
40040029,希露姬的万圣节,4,2,22,150,6,42,400061,1,110020502,110020503,110020504,110060002,110060003,110060004,110200001,558,110200002,AMULET_ARTIST_40040029,呀哈哈♪\n换上了可爱的衣服，\n这样就准备万全了。\n为了守护万圣节，\n我会努力的！,啦啦啦♪\n阻碍万圣节的魔兽，\n让我来清扫干净！\n呐，要好好看着我哦！,看吧看吧♪\n我把魔兽们都打倒了哦！\n这样可以多夸夸我吗？\n会夸我的吧！呀哈哈♪,不给糖就捣蛋♪\n呐，我那么努力，给我奖励吧？\n不给的话，我就要恶作剧了哦。\n啊，但果然……哈哈哈♪\n恶作剧和奖励都想要♪,呵呵，万圣节真开心啊♪\n要是万圣节像这样\n永远持续下去该多好……\n呐，你也这样想吧？\n和我一起一直恶作剧下去吧！,10000,1,2000,1000,0
40040030,美的秘诀,4,1,21,146,6,46,400085,1,212,210000104,210000105,110020202,110020203,110020204,0,0,0,AMULET_ARTIST_40040030,“我说，一大早就拉我来这种\n荒郊野外，到底是要干什么……”\n“哼哼哼……还用问吗！\n当然是——为了变美！”\n“完全不懂你在说什么。”,“用这里的泉水冲洗一整天，\n皮肤就会焕然一新，变得光滑动人！”\n“一整天！？你是不是傻了啊！？”\n“哈哈哈，谁用谁知道。\nLet's beauty！”,“喔？诶诶诶诶！？怎么回事！？\n皮肤真的变光滑了！”\n“怎么样？厉害吧！没错！\n拥有世界第一美貌的我，\n美的秘诀便是——这块宝地！”,“啊……今天也变得更迷人了，\n我真是个罪孽深重的男人啊。”\n“唔……这泉水的功效……\n的、的确不得不承认……”\n“对吧？我果然是如此美貌！”,“快！向着夕阳喊出你的感动吧！”\n“啊！？为什么我要……”\n“这变美的力量，你不也切身体会到了吗？\n来！别害羞！一、二、三！”\n“我好美啊——”,10000,1,2000,1000,0
40040031,休憩中的武士们,4,2,22,151,6,41,400100,1,110021007,110021004,110021005,0,0,0,0,0,0,AMULET_ARTIST_40040031,武士们在树荫下乘凉。\n这时传来了“喵喵”的叫声。\n“啊！是猫哦，米科特大人。\n是您在找的猫吗？”\n“不，‘刀背斩’全身都是黑的……”,喵呜喵呜喵呜……\n猫不停叫着，用脑袋蹭米科特的脚踝。\n“这猫可真黏人啊。”\n“嗯。你知道刀背斩吗？\n它是一只全身如黑夜一般的黑猫。”,米科特温柔地把猫抱了起来。\n这时周围草丛里传来沙啦沙啦的声响……\n“小猫们都聚过来了啊！”\n“刀背斩不在里面吗……\n好吧，就陪陪你们好了。”,米科特的怀里、太郎的膝上。\n小猫们尽情地在二人身上休憩。\n“是很开心啦，可这样没法动弹……”\n“得到天启的我即为自然本身。\n自然即为不动，此乃万物之理……”,越来越多的猫聚集到二人身边。\n然而二人已腾不出手脚。\n于是太郎决定呼唤帮手，\n“武藏大人～\n一起来跟小猫们玩耍吧～”,10000,1,2000,1000,0
40040032,强强联手,4,2,18,122,5,34,400102,1,110021001,110021002,110021003,210000102,210000103,210000104,0,0,0,AMULET_ARTIST_40040032,“虽然害怕战斗……\n不过有希里丝在的话，我会加油！”\n“就是这股气势，梅露莎！\n只要我们两个齐心协力，\n就绝对所向披靡！”,“所、所向披靡是不是有点过了……\n我的力量没什么了不起……”\n“哪有！我就是那么信任梅露莎啊！”\n“希里丝……谢谢你。”,“哎呀，天色暗下来了……\n梅露莎，你还好吗？\n一直不停地战斗，不累吗？”\n“嗯……没问题！\n我……还能继续战斗！”,“不愧是努力上进的梅露莎！”\n“我能这么有干劲……\n都是多亏了希里丝……\n因为希里丝这么信任我！”,“光凭我一个人绝对做不到。\n不过有希里丝在的话……\n无论什么困难都难不倒我！”\n“啊哈哈！你看，我说的没错吧！\n我们绝对就是所向披靡！”,10000,1,2000,100,0
40040033,不一样的视角,4,1,21,140,7,52,400105,1,110070003,110070004,110070005,110060002,110060003,110060004,110200004,334,110200005,AMULET_ARTIST_40040033,“怎么样，卢恩？看得到吗？”\n“好高啊！原来大人\n可以看得这么远，好厉害！”\n“哈哈，是啊！\n你可得长得高一点啊，卢恩！”,“要是能长得像兰扎卜这么高大，\n就能看清远处的景色，\n还能最先抢到落下的花瓣，\n净是些好事啊。”\n“唔、嗯？算是吧！”,“再长高点的话，\n是不是就能够到流星了啊？”\n“嗯，卢恩的话说不定办得到呢。”\n“等我长大了，摘到了流星\n就分给兰扎卜哦！”,“今天看到了很多\n平时看不到的景色，好开心啊！\n谢谢你，兰扎卜！”\n“噢！我也很开心。\n感觉回想起了什么重要的事。”,“听好了，卢恩。这世上也有\n成为大人后就看不到的东西。\n长大固然重要……\n但现在看到的景色，也别忘了啊。”\n“嗯！今天的事，我不会忘的！”,10000,1,2000,1000,0
