Id,Name,Rarity,AmuletType,MinHp,MaxHp,MinAtk,MaxAtk,BaseId,VariationId,Abilities11,Abilities12,Abilities13,Abilities21,Abilities22,Abilities23,Abilities31,Abilities32,Abilities33,CvInfo,Text1,Text2,Text3,Text4,Text5,LimitBreakId,IsPlayable,SellCoin,SellDewPoint,IsHideChangeImage
40050051,牵起你的手,5,4,23,155,7,49,400147,1,110100005,110100005,110100006,0,0,0,0,0,0,AMULET_ARTIST_40050051,无论是身着礼服，还是参加舞会，\n都是新鲜的体验。还有被人牵起手时\n这许久未曾体会到的温暖……\n心中按捺不住的激动之情，\n仿佛要通过牵着的手传达给你……,握住你的手，感受着你的温暖。\n这份温暖令我紧张得手心冒汗。\n虽然因此羞红了脸颊，\n却高兴得不想松开你的手……\n我的心情陷入了矛盾。,像是看穿了我矛盾的心情一般，\n你温柔地牵起了我的手。\n你能敏锐地察觉到他人在逞强，\n并温柔地为其指引方向……\n因此我才下定决心要与你同行。,嘴上说着“我不太擅长舞蹈”，\n却还是温柔地引导着我。\n尽管害羞，我却不想移开视线。\n这是孤身一人时未曾体验过的时光。\n这一刻，我沉浸在慈爱与幸福之中。,我愿为迷茫之人指引方向。\n不过，当我陷入迷茫之时，\n希望你能牵起我的手。\n而当你陷入迷茫之时，\n我也必将向你伸出援手。,10000,1,5000,300,1
40050052,坦率一刻,5,3,22,151,7,53,400148,1,18,18,150,0,0,0,0,0,0,AMULET_ARTIST_40050052,本打算就这么孤独地活下去，\n我不该再和他人有任何瓜葛。\n然而一群怪人却闯进了我的生活，\n对我这样的家伙也露出微笑……\n那明亮的笑容对我来说太过耀眼。,背负罪孽的我没有资格与他人共同欢笑。\n然而他们温暖的光芒却驱散了\n我这种消极的想法。无论是我的罪孽，\n还是那股过于强大的力量……\n他们毫无保留地接受了我的一切。,我很怕再次伤害他人。\n一想到不想再度失去，\n我便愈发感到害怕。\n然而他们毫不在意我的畏惧，\n牵起了我长着锋利指尖的手。,感受着他们的强大与温暖，\n我也不禁露出了笑容，\n想要一直与他们在一起——\n我终于回想起了以前\n心中也曾有过这种想法。,我仍无法坦率地向他们道谢。\n但通过我这满是破绽的表情，\n他们一定早已知晓我的心情……\n也罢。毕竟，今天是向重要的人\n传达心意的节日……,10000,1,5000,300,1
40050053,森林中养成的默契,5,1,26,177,9,64,400172,1,119,120,151,210003302,116,155,129,941,130,AMULET_ARTIST_40050053,某森隐族村落的下任族长——\n拉拉诺亚。她与爱犬洛夫之间\n有着难以动摇的亲密关系。\n“乖孩子乖孩子！洛夫真听话！”\n“汪！哈、哈、哈～”,拉拉诺亚的村落有这样的风俗——\n被选为下任族长的人会得到一只小狗。\n小狗将与主人一同经历严苛的训练，\n成长为出色的猎犬，\n最终成为主人的默契搭档。,“噢！发现鱼了！\n这鱼真鲜活！上啊，洛夫！”\n“汪汪！”\n拉拉诺亚的话音刚落，\n洛夫便以迅雷不及掩耳之势衔住了鱼。,如此默契的配合，\n是基于洛夫对拉拉诺亚的无比信任。\n只要拉拉诺亚一声令下，\n纵使刀山火海，\n洛夫也会毫不犹豫地冲入其中。,配合默契的拉拉诺亚和洛夫所向披靡，\n没有他们捕不到的猎物。\n“好！今天要给村落里的所有人\n带礼物回去！洛夫，目标是100条鱼！”\n“汪……汪！？”,10000,1,5000,3000,0
40050054,母爱,5,3,22,151,7,53,400176,1,110370004,110370005,110370006,131,945,132,127,943,128,AMULET_ARTIST_40050054,拥有美丽彩翼的龙——思摩夫，\n花费了数百年的漫长时间\n孵化龙蛋，等待着孩子的降生。\n这便是，令人敬仰的母爱。,无论风霜雨雪……\n无论酷暑严寒……\n思摩夫都始终如一地倾注着母爱，\n不曾离开自己的蛋半步。\n终于，等待已久的瞬间来临了。,新的生命破壳而出，\n可爱的雏龙探出了脑袋。\n仿佛为降生在这个光明的世界而喜悦，\n幼小的生命张开翅膀望向母亲，\n发出了第一声响亮的鸣叫。,雏龙降生后，思摩夫的爱丝毫不减。\n她更加投入地照顾孩子。\n雏龙在母爱的温暖之下，\n感受着幸福的时光，\n茁壮成长。,数百年后，长大成年的小思摩夫\n也产下了自己的蛋。\n正如母亲当年对自己的付出，\n她也对蛋倾注了长久的精力。\n令人敬仰的母爱就像这样不断传承。,10000,1,5000,300,0
40050056,沧海女王,5,2,24,165,5,39,400108,1,110280501,177,110280502,110270401,172,110270402,110210202,167,110210203,AMULET_ARTIST_40050056,水上都市圣罗塔斯的大海里，\n栖息着一头守护这片海洋的龙。\n她便是青龙墨丘利。\n她悠然地眺望着鱼群，\n神情中充满了慈母般的深深爱意。,即使在她上陆之后，\n大海仍对她无比重要，\n那是她的归处，也是她要守护的地方。\n鱼群们欢迎墨丘利的归来，\n她也对大海中的生命广施慈爱。,然而，对于亵渎大海之人，\n她绝不会手下留情。\n和颜悦色变为雷霆盛怒，\n卷起惊涛骇浪，\n海面顿如暴风过境般疯狂。,惹怒她的人无法得到宽恕，\n也休想躲过制裁。\n据说胆敢与沧海女王为敌者，\n唯有后悔自己的愚蠢行径。,心地善良、时而严厉的龙\n守护着水上都市圣罗塔斯的大海。\n愿行至此处的旅人心存正道，\n所遇均为墨丘利温柔的一面。,10000,1,5000,300,0
40050057,英雄降临,5,1,26,176,9,65,400277,1,210000804,210000805,210000806,210001101,210001102,210001103,161,163,164,AMULET_ARTIST_40050057,在阿尔贝里亚饱受帝国摧残之际，\n两位英雄降临了。\n亚斯克王国的阿尔冯斯王子\n与尼福尔王国的菲约尔姆公主\n穿过异界裂缝现身于此。,英雄们在阿尔贝里亚王子的帮助下\n尝试回到原来的世界，\n却遭到了帝国军的百般阻挠。\n二人觉察到在帝国背后伺机而动的仇敌，\n誓要与之抗争到底。,战场上英雄们的身姿英勇而又华丽。\n阿尔冯斯的剑身迸发出炫目的蓝光，\n菲约尔姆的枪尖被美丽的冰雪环绕。\n二人的武器释放出的光芒融为一体，\n化作苍蓝的冰晶驱散无尽的黑暗。,英雄们展现出了天衣无缝的配合：\n一方杀入敌阵，另一方便转为守势；\n一方不慎负伤，另一方便为其御敌。\n共同经历过无数战乱的二人之间，\n有着心照不宣的默契。,二人将一直与圣城的伙伴们并肩作战，\n直到这个世界……不，直到侵蚀无数世界的\n邪恶被彻底铲除、和平到来的那一天。\n即使回到了原来的世界，\n他们的这份信念也仍会照耀世间。,10000,1,5000,3000,0
40050058,跨越时空的友情,5,1,22,150,8,54,400280,1,210000104,210000104,210000106,110120007,110120008,110120001,0,0,0,AMULET_ARTIST_40050058,两位王子跨越时空，遇到了彼此。\n虽然他们生于不同的世界，\n所见所闻也大相径庭，\n却拥有相同的正义之心。\n为了守护世界，二人携起手来。,正所谓不打不相识。\n两位王子为秉承自己的信念\n一度将手中的剑指向对方。\n然而二人均在对方的眼神之中感受到了\n不可退让的正义之心与毋庸置疑的温柔。,两位王子握手言和并成为了伙伴。\n即使意见偶有不合，\n二人也不曾为此争斗。\n因为他们都懂得尊重并学习\n对方与自己的“不同之处”。,两位王子互相促进提高，\n共同面对困境。\n为了守护各自的世界……\n这并非易事，\n但所有人都坚信他们的正义。,两位王子在合作之中萌生了友情。\n然而离别之日将近，\n为守护各自的世界，二人决意就此分别。\n紧紧相握的手代替了再会的承诺，\n二人的友情绝不会就此消失。,10000,1,5000,300,1
40050059,历经悠久岁月,5,2,29,195,6,46,400083,1,139,199,140,110020407,141,154,0,0,0,AMULET_ARTIST_40050059,映入眼帘的是荒芜的王都。\n耳畔回荡的是萧瑟的风声。\n从长眠中醒来的王女，\n孤身一人仿徨于世间。,所爱的国家已成沙漠，\n幸福的岁月已被埋没。\n独自存活下来的王女\n内心怅然若失。,她来到了从未见过的异国，\n眼前是一座古老的城堡。\n圣城那令人怀念的感觉宛如绿洲，\n治愈了王女的身心。,新伙伴们的温柔\n温暖了王女冰冷的身心。\n在圣城度过的愉快生活\n好似曾在故国的时光。,时移世易永不停歇，\n但世间确有不变之物。\n亡国的王女不会沉浸于悲伤。\n历经悠久岁月，再次触到的温柔\n填补了她内心的空虚……,10000,1,5000,3000,0
40050060,梦中的校园生活♪,5,2,29,195,6,46,400168,1,210000204,210000205,210000206,207,208,209,0,0,0,AMULET_ARTIST_40050060,明天是梅莉贝尔第一次去上学。\n她不停地往书包里塞东西，\n可小小的书包哪里装得下\n她的兴奋与激动之情。\n一旁的小兔子看起来有些担心。,“兔兔不用担心哦！\n因为我已经是大人了！”\n小兔子听说镇上的人们都很可怕，\n担心得不得了，\n便悄悄藏进了书包。,次日，梅莉贝尔带着小兔子来到学校。\n“我是来自森林的梅莉贝尔！\n这些兔兔是我的好朋友……\n请、请多多关照！”\n教室里响起了温暖的掌声。,课间休息时，许多小朋友\n都来找梅莉贝尔聊天。\n他们轻轻抚摸着小兔子，\n称赞小兔子好可爱。\n这对于小兔子来说也是新鲜的体验。,于是小兔子在接下来的日子里\n都会藏进梅莉贝尔的书包里。\n小兔子和梅莉贝尔一样，\n也喜欢上了学校，\n明天也要高高兴兴去上学！,10000,1,5000,3000,0
40050061,新娘是头龙,5,1,26,177,9,64,400096,1,8,146,211,110220002,165,110220003,0,0,0,AMULET_ARTIST_40050061,身着洁白的婚纱，\n和他在圣洁的教堂中许下爱的誓言……\n“啊啊……能和亲爱的结婚，\n就像做梦一样。亲爱的，我好幸福……”\n“我也是，宝贝。跟我白头偕老吧。”,“亲爱的，你真的不后悔吗……”\n“宝贝！我非你不可！\n因为只有在你面前，\n我才能保持真实的自我！”\n“亲爱的……我好开心！”,“诶嘿嘿♪亲爱的，来这边♪”\n“啊哈哈♪宝贝，等等我啊♪”\n“呀……被你抓到啦♪”\n“我绝对不会放开你，永远……”\n“亲爱的……我爱你……”,“我的宝贝，转过身来……”\n“亲爱的，突然间怎么了嘛……\n诶诶诶？难难难、难道是要接吻！？\n真是的，亲爱的你好积极哦！\n来吧……亲、爱、的♪”,“呀啊，亲～爱～的♪哈！\n唔……什么嘛，原来是梦啊。\n不过，多么幸福的美梦啊……\n总有一天我要让这个美梦成真！\n等着我哦……亲爱的♪”,10000,1,5000,3000,0
40050062,难忘的夏天,5,2,28,188,7,52,400334,1,259,260,261,145,262,263,0,0,0,AMULET_ARTIST_40050062,“原来如此……这就是捞金鱼吗。\n诶，你问我知不知道规则？\n哎呀，放心吧。我可是长辈，\n这种事小菜一碟，嘿！\n它、它破了是……纯属巧合！”,“悄悄地……悄悄地……\n啊啊，又被它跑了。\n捞金鱼好难啊。你那边如何？\n1、2、3……居然有７条！\n真厉害呢，呵呵。”,“怎么了？跑来这么远的地方。\n啊……仙花焰！蓬莱小镇的仙花焰\n已经传到这一带来了啊。你早就知道\n这里是观赏仙花焰的绝佳场所了吗？\n真是见多识广呢。”,“各种小摊，还有五彩缤纷的仙花焰。\n祭典真是太棒了。不过……\n没想到你竟然会邀请我一起来。\n那时候的你，很紧张吧？\n脸颊都红透了哦。”,“诶？太羞耻了所以当时你很紧张的事\n要替你保密？没想到你还有这样的一面。\n嗯……我知道了。\n你那可爱的表情，是只属于我的宝物，\n也是我难忘的夏日回忆。”,10000,1,5000,3000,0
40050063,三姐妹的日常,5,3,26,176,9,64,400243,1,287,306,307,110070003,110070004,110070005,324,325,326,AMULET_ARTIST_40050063,“雷吉姐，早呀！”\n“早上好，卢吉娜。”\n“呐呐，难得的休息日，\n我们一起出门吧！”\n“好主意～那就开始准备吧♪”,“唔喵……我要成为……世界第一……”\n“看来罗吉娜还在睡梦中呢。”\n“罗吉姐快起来！要出门了哦！”\n“唔……要去吃饭……吗？”“当然！”\n“了……解！好了，换好衣服出发吧！”,“吃什么好呢？我肚子已经咕咕叫了～”\n“快看快看，那个怎么样？”\n“可丽饼啊，看起来很好吃呢♪”\n“好多奶油……嗯，这个好。\n就吃这个吧？决定了！”,“看！额外送了我们一个哦♪”\n“这是八叶草的可丽饼吧。”\n“让我尝一口！”“啊，我也要！”\n“啊～让姐姐也尝一尝～”\n“吃完一起去购物吧！”,“苹果真便宜啊！运气超好！”\n“回家烤苹果派吧。”\n“OK，火候就交给我来控制吧。”\n“我来备茶。”\n“休息日三个人一起，快乐也是三倍呢♪”,10000,1,5000,3000,0
40050064,龙之铁匠铺,5,4,23,155,7,49,400245,1,210001101,210001102,210001103,320,321,322,327,328,329,AMULET_ARTIST_40050064,“呼……锻造的火候，\n差不多就是这样吧？”\n“嗯！真不愧是穆穆啊！\n这温度不冷不热，用来打铁正好……\n简直是理想中的火焰啊！”,“阿尔库特斯你才是，\n那么胖乎乎的爪子还如此灵巧。”\n“这全靠努力和毅力！\n毕竟常年不断特训嘛！”,“很好！每一个都质量上乘！\n那么，现在终于……”\n“嗯！龙之铁匠铺，正式开张！\n走过路过不要错过！\n快来瞧一瞧看一看啊！”,“生意不错啊，阿尔库特斯！\n卖得飞快呢！”\n“那是当然！\n我这修炼百年的锻造手艺……\n怎么会输给那些路边的铁匠铺！”,“太好了！都卖完了呢！”\n“不……还没完！现在！\n立刻补充商品！我们可是\n不需要锻造工坊的龙之铁匠铺！\n随时随地都可以打造武器！”,10000,1,5000,300,0
40050065,万雷之王,5,2,24,165,5,39,400158,1,110320901,179,110320902,110310801,174,110310802,110210402,169,110210403,AMULET_ARTIST_40050065,“其名曰雷之王，愤怒铁锤自天降。”\n人们十分畏惧辉龙朱庇特那强大的力量。\n曾有一位愚蠢的贵族男子\n因惹怒辉龙而遭到处决的故事\n流传至今，时刻警示着世人。,“区区朱庇特，不足为惧。”\n过去，有一位不知天高地厚的贵族男子\n为彰显自己的权势而企图捕获辉龙。\n男子无视人们的劝阻，\n率领大部队向山顶进发。,“想必你已做好了相应的觉悟。”\n当贵族男子抵达山顶时，\n等待着他的，是怒火中烧的辉龙。\n他的愤怒让天空霎时变得\n乌云密布、电闪雷鸣。,“愚蠢如你，竟敢侵犯我所守护的大地，\n真是罪该万死！”\n辉龙无视贵族男子的求饶，\n用贯穿天地的巨雷处决了他，\n其临死前的哀嚎响彻整片山谷。,辉龙不会放过任何擅闯此山的家伙。\n但对山脚下的人们来说却是另一回事。\n愤怒的雷鸣带来了丰收之雨，滋润农田。\n因此，人们将辉龙尊称为\n“我们可靠的守护者——万雷之王”。,10000,1,5000,300,0
40050066,盛夏的圣骑士,5,1,26,177,9,64,400098,1,336,337,338,210002701,210002701,210002701,0,0,0,AMULET_ARTIST_40050066,“埃尔菲莉丝，\n红茶还合你的口味吗？”\n“嗯，非常好喝。\n朱丽叶，谢谢你\n邀请我来私人海滩玩。”,“不过，这是你家的私人海滩吧？\n我来这里没问题吗……”\n“当然了。因为姐……不、不对，\n因为你是特殊的。”,“好了，享用完下午茶\n就去海里玩吧！\n这片大海现在只属于我们两个人。\n让我们玩个尽兴！”\n“嗯！我们走吧，朱丽叶！”,“呵呵，这感觉真是新鲜。”“你指的是？”\n“像这样跟其他圣骑士一起玩。\n就算平时常在一起锻炼，\n但不太有机会分享喜悦吧？\n所以你能邀请我，我很开心。”,“我也是……能和姐姐大人一起来海边，\n好开心……”“诶？”\n“不，没什么！话说如果\n仅满足于到此一游，也太可惜了吧？”\n“你说得对！好，那我们一起去游泳吧！”,10000,1,5000,3000,0
40050067,海边的公主,5,1,26,176,9,65,400338,1,210000304,210000305,210000306,339,340,341,367,368,369,AMULET_ARTIST_40050067,无边无际的蔚蓝之海！\n穿云而下的灿烂阳光！\n果然盛夏来度假最棒了！\n还有……身着泳装的我！\n呵呵，可以尽管称赞我哦？,不过，本就不能指望你的赞美之词吧。\n真拿你没辙呢。\n就让我来告诉你\n身为护花使者该做的事吧。\n首先，陪我去海里。现在就出发。,啊……多么美丽啊！\n五彩斑斓的珊瑚，还有可爱的热带鱼～\n全都是宫殿里看不到的东西！\n好了，你也别光看着，\n来和我一起游泳吧！,真奇妙……\n只要跟你在一起，\n平时的忧虑、公主的重压，\n这些烦心事都能抛诸脑后。\n果然，我对你……,我游累了，今天就先回去吧。\n呵呵……别为我担心。\n度假还远没有结束呢。\n一起创造出更多属于我们两个人的、\n无法忘怀的美好回忆吧……,10000,1,5000,3000,0
40050068,冲浪兄妹,5,1,22,151,8,54,400340,1,210003201,342,343,363,364,365,370,371,372,AMULET_ARTIST_40050068,“准备运动做好了吗？”“好了！”\n“防晒霜涂了吗？”“万无一失！”\n“那我们走吧，希里丝！\n期盼已久的冲浪时间到！”\n“向着大浪！冲啊！”,“哇哈哈！你不快点的话，\n哥哥我就抢先一步冲上大浪啦！”\n“会像卢卡哥哥想的这么容易吗～\n射箭和冲浪都是我最厉害～\n看我的！”,“呜～还是希里丝更胜一筹吗……”\n“喔，卢卡哥哥不服输吗～”\n“我还没输呢！诶，飘来的这是……\n喂，希里丝，给你这个！”\n“咦，什么？哇，好漂亮的花！”,“诶嘿嘿，好开心。谢啦，卢卡哥哥！”\n“嗯嗯，不错！很可爱哦～”\n“不过卢卡哥哥……你是不是忘了什么？\n这样下去我可要赢啦。”\n“啊！？对了，我们还在比赛呢……”,“算了！这次就算你赢了！”\n“咦？这么痛快！？你这是怎么了？”\n“我玩得很尽兴，\n你也很喜欢我送你的花，满足了！\n但是……下次我可不会输了啊？哇哈哈♪”,10000,1,5000,300,0
40050069,二人的情谊,5,1,26,176,9,65,400097,1,394,395,396,210000503,210000504,210000505,0,0,0,AMULET_ARTIST_40050069,“沙音好会做花冠啊！真漂亮！”\n“埃尔菲莉丝喜欢的话，\n就送给你吧。\n毕竟你戴上比我更合适。”\n“诶？是吗……”,“对了！把我的花冠给沙音戴上……\n你看！很适合你啊！”\n“谢、谢谢……我能收下\n埃尔菲莉丝的这顶花冠吗？”\n“当然了！我们来交换！”,“真令人怀念啊，沙音。小时候\n我们两个经常在花田里玩耍呢。”\n“是啊……真没想到\n如今还能像这样和埃尔菲莉丝\n一起眺望这美景。”,“虽然那天的花冠早已不在……\n但那份回忆一直留在我心里。”\n“没错。就算花儿凋零，你我的情谊\n也永远不变。我再也不要失去你！”\n“埃尔菲莉丝……谢谢你。”,“虽然早已过了互赠花冠的年纪……\n但我终于拥有了能保护你的力量。\n我一定会守护好你的身后。”\n“我也是。让我们互相扶持吧，沙音。\n就这么说定了哦。”,10000,1,5000,3000,0
40050070,我们是圣城啦啦队！,5,3,26,178,9,62,400380,1,287,306,307,110010403,110010404,110010405,0,0,0,AMULET_ARTIST_40050070,“前辈前辈！今天是期待已久的\n圣城运动会！准备好了吗！？”\n“嗯，要拿着花球去应援吧？”\n“没错！拿好花球后，\n要再换上这件制服哦！”,“诶，一定要换吗？”\n“如果穿上一样的制服，\n就精神百倍呀！”\n“我、我知道了。论加油的话\n你是前辈呢。那就换上制服吧！”,“加、加油，加油……”\n“唔～声音有点小呢？\n试着从肚子里大声喊出来！”\n“从肚子里……原来如此。\n交给我吧！加油！加油！”,“状态不错！你很擅长加油呢，前辈♪”\n“是你指导有方。呵呵，\n有我们加油，大家也干劲十足呢”\n“这说明我们的喊声传达到了！\n来吧前辈，下次要用最灿烂的笑容！”,“加油！加油！加油！”\n“用最灿烂的笑容哦，前辈♪\n上吧上吧，冲啊冲啊！\n来吧前辈，最后和艾玛一起！”\n“加油，加油！”,10000,1,5000,3000,0
40050071,黑暗统御者,5,2,24,165,5,39,400382,1,110341101,180,110341102,110331001,175,110331002,110210502,170,110210503,AMULET_ARTIST_40050071,“想要迈进至未来的你啊！\n现在再次跨越试炼，展现你的潜力吧！”\n伴随着其呐喊，瞬间黑暗四溢。\n释放出真正力量的佐迪亚克\n从无尽的暗影中展开攻击。,“原来如此……这招也能抵御住吗。\n看来还有点真材实料。\n那么……这招如何？”\n暗黑色的液体从暗影中喷出。\n为与之抗衡，王子一行人拼命向前。,王子的眼神中丝毫没有要放弃的意思。\n暗龙静静地笑了。他一定能通过这个试炼——\n暗龙如此坚信着，再次发出咆哮。\n“我见识到了你的觉悟！\n接招吧，拥抱我毕生之黑暗吧！”,忽然……行尸走肉出现，包围了王子等人。\n死者的怨念折磨、玩弄着他们。\n王子的双腿在可怕的攻击下动弹不得。\n但是，他很快克服了恐惧，\n更用力地握紧了手中的剑。,“伟大的暗龙啊。你所有的攻击，\n我都已经看穿了。我一定要超越你……\n超越我的父亲！”\n王子高举手中的剑，用浑身之力放出一击。\n暗龙深深地点头，接下了那一剑。,10000,1,5000,300,0
40050072,无尽的华尔兹,5,1,26,177,9,64,400384,1,210000304,210000305,210000306,110370003,110370004,110370005,0,0,0,AMULET_ARTIST_40050072,“欢迎来到我们的派对。\n我拜托哥哥们\n帮我做好庆祝的准备了。\n那个……不介意的话，\n能和我跳一支舞吗？”,“我……跳得好吗？\n我还是第一次准备派对，\n虽然很辛苦，但能和你一起跳舞，\n那么努力也算是值了。\n我现在幸福得像在做梦！”,“欢迎来到我们的派对。\n呵呵，今晚不用拘于礼节。\n已经备好了歌颂伟业的演奏、祝酒和料理。\n怎么了？不要害怕，牵起我的手吧。\n让我们度过梦幻般的时光吧。”,“你在惊讶什么？\n对我来说，跳舞易如反掌哦。\n即使这个夜晚如同荣华破灭的前夜，\n宴会只存在于刹那之间，\n我们共度的热情时光也不会改变……”,“这是一夜的幻觉，亦或是白日梦？\n呵呵……答案根本无所谓吧？\n现在就忘记一切，投身于虚幻的喜悦之中。\n然后和我一起跳舞吧——\n永无止境的圆舞曲！”,10000,1,5000,3000,0
40050073,古老的盟约,5,1,26,176,9,65,400084,1,8,146,211,110140301,110140302,110140303,0,0,0,AMULET_ARTIST_40050073,碧龙耶梦加得曾遇到的那个男子，\n其无所畏惧与豪迈奔放\n丝毫不逊于人称暴风之主的碧龙。\n甚至连那狂暴之龙的居所，\n男子也能从容地久居。,“你怎么总是这样……”\n耶梦加得嘴上虽抱怨，\n却逐渐对他的自由心生钦佩，\n希望他那纯粹而美丽、\n率直而伟大的灵魂能永驻不朽，然而……,越是志向高远、强大而优秀的人，\n越是会奋不顾身地投身于战场。\n他承受着肉体与精神的痛苦，坚持奋战。\n耶梦加得作为契约龙与他共赴无数战场，\n仅有一次问过他。,“人类啊，守护众人的力量，\n有时却唯独无法保护你自己。\n你没有想过追求寻常的幸福吗？”\n那是战斗最激烈的时刻，\n但他仍报以微笑，有力地握剑而立。,“这是我早已知晓却依旧选择的道路。\n你会懂我的吧，我的朋友。”\n他那直视未来的双眼之中没有丝毫迷茫。\n“这样啊……”耶梦加得屏息颔首，\n“那我就履行盟约吧，我的朋友。”,10000,1,5000,3000,0
