Id,Name,Rarity,AmuletType,MinHp,MaxHp,MinAtk,MaxAtk,BaseId,VariationId,Abilities11,Abilities12,Abilities13,Abilities21,Abilities22,Abilities23,Abilities31,Abilities32,Abilities33,CvInfo,Text1,Text2,Text3,Text4,Text5,LimitBreakId,IsPlayable,SellCoin,SellDewPoint,IsHideChangeImage
40020001,勇跃指环,2,3,5,36,1,12,400001,1,110090001,110090002,110090003,0,0,0,0,0,0,AMULET_ARTIST_40020001,远古时代效忠于阿尔贝里亚王国的\n某位勇敢骑士所持有的魔法指环。\n镶嵌在指环上的蓝宝石仍蕴含微弱的魔力，\n相传它可以守护佩戴者。,远古时代效忠于阿尔贝里亚王国的\n某位勇敢骑士所持有的魔法指环。\n佩戴指环消灭了无数魔兽的骑士\n因此得名指环骑士，受到人们的赞颂。,远古时代效忠于阿尔贝里亚王国的\n某位勇敢骑士所持有的魔法指环。\n相传骑士与魔兽殊死战斗之际，\n指环曾与其勇敢的灵魂产生共鸣，\n发出耀眼的光芒。,远古时代效忠于阿尔贝里亚王国的\n某位勇敢骑士所持有的魔法指环。\n指环骑士为了保护新兵青年\n而殒命讨伐魔兽的战场。\n这位拯救伙伴的英雄最终被人厚葬。,远古时代效忠于阿尔贝里亚王国的\n某位勇敢骑士所持有的魔法指环。\n虽然指环骑士殒命战场，\n但他救下的青年继承了他的指环，\n作为新的指环骑士名留后世。,10000,1,50,0,0
40020002,海鲜汤,2,3,5,36,1,12,400002,1,110120005,110120006,110120007,0,0,0,0,0,0,AMULET_ARTIST_40020002,这位客人，欢迎光临！\n新鲜的大虾、鱿鱼、蛤蜊！\n圣罗塔斯引以为傲的海产\n烹制而成的海鲜汤！快来尝尝吧！,这海鲜汤是奶奶\n还在世的时候教我做的，\n所以有着回忆的味道……\n嗯？这么快就喝完了！？\n别急，这就去给你再盛一碗！,来！热乎的海鲜汤！\n怎么样，美味得停不下来吧？\n当年在圣罗塔斯开店的时候，\n这海鲜汤一经推出就大受好评。\n现在已经是这里的招牌菜。,因为这汤实在太美味，\n当初有位客人死缠烂打\n求我教她做法。\n无论怎么拒绝她都不死心，\n不得已只好收她为徒了。,缘分这东西真是不可思议。\n当初的徒弟，现在已是老板娘了。\n哈哈哈！多亏了这海鲜汤，\n那之后的人生简直如鱼得水。\n我都不知道该怎么感谢奶奶！,10000,1,50,0,0
40020003,龙之秘药,2,3,5,36,1,12,400003,1,110220001,110220002,110220003,0,0,0,0,0,0,AMULET_ARTIST_40020003,蕴藏着龙之力的秘药。\n据说是由某位古怪的魔法师\n收集脱落的龙鳞\n熬制而成的。,蕴藏着龙之力的秘药。\n魔法师四处推销此药，\n称只要喝了它就能获得龙之力。\n然而，购买者喝下后\n并没有任何效果。,蕴藏着龙之力的秘药。\n自觉受骗的人们纷纷扔掉秘药，\n但其实魔法师所言不虚。\n只有与龙缔结契约之人，\n才能发挥秘药的真正价值。,蕴藏着龙之力的秘药。\n秘药在与龙缔结契约之人手里\n会发出淡淡的微光。\n据说这是因为秘药成分中的龙鳞\n感应到了契约者的魔力。,蕴藏着龙之力的秘药。\n喝下秘药的契约者将获得巨大的力量。\n然而秘药是把双刃剑。\n喝得越多，契约者就会变得越不像人类，\n而是更接近卓越的龙……,10000,1,50,0,0
40020004,魔力源点,2,1,5,35,1,13,400004,1,110060001,110060002,110060003,0,0,0,0,0,0,AMULET_ARTIST_40020004,不断涌出大量魔力的特殊地点。\n这充满魔力的神秘空间\n自古以来就作为神圣之地\n被附近的村民所崇奉。,不断涌出大量魔力的特殊地点。\n这充满魔力的神秘空间\n是施展魔法的最佳场所。\n据说周游世界的魔法师们为了修行，\n有时在这里一待就是数月。,不断涌出大量魔力的特殊地点。\n每隔数月，\n它便会释放异乎寻常的魔力。\n释放出的庞大魔力滋养大地，\n使众多生命充满活力。,不断涌出大量魔力的特殊地点。\n相传它附近的区域\n可以得到神圣之力的加护。\n古代的人们曾以魔力源点为中心\n建造了巨大的都市。,不断涌出大量魔力的特殊地点。\n全世界的魔力源点都是通过\n地下深处流动的魔力汇聚在一起。\n魔力源点喷涌而出的魔力\n也是世界正在呼吸的证明。,10000,1,50,0,0
40020005,陈旧的竖琴,2,4,5,36,1,12,400005,1,110100001,110100002,110100003,0,0,0,0,0,0,AMULET_ARTIST_40020005,放置在酒馆角落的陈旧竖琴。\n据说在很久以前，\n一位吟游诗人用这架竖琴\n弹唱了一首人与龙之间的悲情恋歌。,放置在酒馆角落的陈旧竖琴。\n吟游诗人弹唱的人龙恋曲扣人心弦，\n令人身临其境、感同身受，\n倾听的人们纷纷沉醉其中。,放置在酒馆角落的陈旧竖琴。\n某一天，倾听的客人再也抑制不住好奇，\n向吟游诗人打听人龙之恋的结局，\n但吟游诗人沉默不语，只是低头沉思。,放置在酒馆角落的陈旧竖琴。\n客人们以为打扰了吟游诗人的兴致，\n吟游诗人却又若无其事地开始弹唱。\n酒馆重新回到了原本喧嚣快乐的夜晚。,放置在酒馆角落的陈旧竖琴。\n客人们离开后空荡荡的酒馆里，\n吟游诗人仍然独自一人弹奏着竖琴，\n想要把这美丽的音符\n送给那永远无法再次相见的恋人。,10000,1,50,0,0
40030001,名马斯卡比特,3,1,10,71,3,25,400006,1,110080002,110080003,110080004,0,0,0,0,0,0,AMULET_ARTIST_40030001,曾经有一匹马不愿被任何人骑，\n因此被人们称作狂马。\n然而，驯服它的男人出现了。\n他的名字叫作丹。\n——被后世称为“霸王”的男人。,那是一匹会害死骑士的凶煞之马。\n有占卜师这样忠告丹。然而丹却不以为然，\n“你看它凶煞，是因为你害怕被它伤害，\n也就是说，你是我的敌人。”\n说着，丹斩杀了占卜师。,被称作斯卡比特的狂马\n与王一同驰骋战场。\n传说它宛如奔腾荒野的狂风，\n又如划过天际的流星。,久经沙场的斯卡比特\n却从未受过伤。\n一定能共同抵达世界的尽头。\n人与马对此都曾深信不疑……,被称作霸王的丹，最终还是死了。\n即便是战场上所向披靡的斯卡比特，\n也难以将王从阴谋诡计中拯救出来。\n斯卡比特独自奔向了战场，\n因为它想不出其他办法为王送行。,10000,1,300,150,0
40030002,圣光轮,3,4,10,73,3,23,400007,1,110100002,110100003,110100004,0,0,0,0,0,0,AMULET_ARTIST_40030002,对伊莉雅教徒来说，\n圣光轮是最重要的象征之一。\n因为它代表着\n女神伊莉雅带来的光明。,伊莉雅教徒最基本的祈祷方法\n是模仿圣光轮在胸前画圆。\n圆的画法有很多严格的规范。,据说女神回应教徒的祈祷时，\n圣光轮会放出光芒。\n这就是常在传说中登场的“显灵”，\n也是教徒的心灵支柱。,圣光轮上的四个棱角，\n分别代表着被称为四德的\n“思虑”、“慈爱”、“勇气”和“虔诚”。,阿尔贝里亚的人们无论是新生命诞生，\n还是父母去世，都会向圣光轮祈祷。\n圣光轮的光辉与阿尔贝里亚同在，\n是阿尔贝里亚民众的精神食粮。,10000,1,300,150,0
40030003,下午茶时光,3,3,10,71,3,25,400008,1,110120006,110120007,110120008,0,0,0,0,0,0,AMULET_ARTIST_40030003,欢迎光临。\n这里有上好的点心、美味的红茶。\n您可以优雅享受午后时光。,礼仪？规矩？这些确实重要。\n不过，最重要的是拥有一颗\n享受下午茶时光的心。,今天为您准备了特别的茶具。\n享受下午茶的方式多种多样，\n您能够在视觉、嗅觉、味觉上\n都得到满足。,请问要在茶里加点什么呢？\n牛奶？香草？果酱？还是蜂蜜？\n不过这些都不如您的笑容香甜。,快乐的时光总是那么短暂。\n不过，等待的时间越漫长，\n再会的时候越是甜蜜呢。\n下一次将是只属于\n我们两人的下午茶时光。,10000,1,300,150,0
40030004,颠茄花,3,3,10,71,3,25,400009,1,110130002,110130003,110130004,0,0,0,0,0,0,AMULET_ARTIST_40030004,颠茄花是生长于阿尔贝里亚的\n多年生野生植物。\n厚重的花瓣是它的特征之一，\n它开出的花朵洁白而美丽。,颠茄花的毒性很强。\n如不慎摄入，会出现痉挛、呕吐等症状。\n虽然很少危及生命，不过仍需注意。,颠茄花开花后，\n花瓣很快就会变得十分鲜艳。\n“龙之守护者”一族认为，\n给幼龙喂食这种鲜艳的花\n将有益它们的成长。,颠茄花主要生长在高山地带。\n因为常出现于雾气环绕的山间，\n它也被称作“迷雾女王”。,颠茄花的花语是“不为人知的美”、\n“刹那间的美”、“请看着我”。\n那转瞬即逝的美丽和梦幻，\n自古便有种令人痴迷的魔力。,10000,1,300,150,0
40030005,阿尔贝里亚国旗,3,1,10,71,3,25,400010,1,110070002,110070003,110070004,0,0,0,0,0,0,AMULET_ARTIST_40030005,飘扬吧，勇敢的龙之旗啊！\n我们伟大的王，流淌着龙之血。\n我们向龙之血宣誓效忠。\n啊，阿尔贝里亚，阿尔贝里亚！,飘扬吧，勇敢的龙之旗啊！\n深爱的大地，由我们守护。\n与龙一起，追随伟大的王。\n啊，阿尔贝里亚，阿尔贝里亚！,飘扬吧，勇敢的龙之旗啊！\n我们要挑战，邪恶的魔神。\n勇往直前，胜利就在前方。\n啊，阿尔贝里亚，阿尔贝里亚！,飘扬吧，勇敢的龙之旗啊！\n我们期待着王的凯旋。\n和平与王一起，消失在大地尽头。\n啊，阿尔贝里亚，阿尔贝里亚！,在万丈光芒中飘扬，勇敢的龙之旗啊！\n我们祈祷着，永世的安宁。\n逝去之王的心，将与我们同在。\n啊，阿尔贝里亚，阿尔贝里亚！\n挥舞旗帜吧，阿尔贝里亚的子民！,10000,1,300,150,0
40030006,破天角笛,3,1,10,71,3,25,400011,1,110390002,110390003,110390004,0,0,0,0,0,0,AMULET_ARTIST_40030006,嘟——\n“喂！新来的！这是进军的号角！\n赶紧跟上别掉队！”,嘟，嘟，嘟——\n“不好！新来的，这是敌军来袭的号声！\n想活命就赶紧跑！”,嘟——嘟——\n“新来的，开始进攻了！\n混账家伙，别急着立功！\n真是个不让人省心的家伙！”,嘟，嘟嘟，嘟——\n“新来的，该冲锋了！\n敌人可不管你是不是新兵！\n别白白丢了性命啊！”,嘟嘟，嘟——嘟——\n“太好了！是胜利的号角！\n这下你也从新兵毕业了！独当一面？\n说什么傻话，你还嫩着呢！\n以后还要好好锻炼你！”,10000,1,300,150,0
40030007,山巅咆哮的獠牙,3,3,10,71,3,25,400012,1,110090002,110090003,110090004,0,0,0,0,0,0,AMULET_ARTIST_40030007,山岳都市克里夫堡有这样一个传说。\n多尼托斯山脉中有一座山。\n其统治者既非人类也非龙，\n而是狼。,立于山顶向天怒吼的那匹狼，\n不知何时起被称作\n“山巅咆哮的獠牙”。\n但凡目睹过它威严身姿的人，\n都会认可它才是这里的主宰。,在山巅咆哮的獠牙众多的传说中，\n有一个故事显得格外有名。\n相传在一个红月之夜，\n它救下了被遗弃在山上的婴儿，\n并让狼群中的母狼喂养长大。,城里的人们口口相传，\n被遗弃在山上由狼养大的婴儿\n就是克里夫堡的创建者。\n在克里夫堡，狼是受人尊敬的存在。,无人知晓山巅咆哮的獠牙结局如何。\n相传是在红月之夜升天而去。\n如今的克里夫堡\n将红月之夜称作“獠牙之夜”，\n正是源于这个传说。,10000,1,300,150,0
40030008,“结社”的假面,3,2,11,76,3,20,400013,1,110020501,110020502,110020503,0,0,0,0,0,0,AMULET_ARTIST_40030008,“结社”……\n令人难以忘记的名字。\n在暗处活跃，妄图侵蚀世界的组织。\n——那便是“结社”。,啊，对了。“结社”那群家伙，\n都戴着令人毛骨悚然的面具。\n据说那是抹杀自我、效忠组织的证明。,戴着面具的疯狂组织“结社”……\n要追踪他们的蛛丝马迹并不容易。\n但是一定要找到、消灭他们！\n向他们复仇，就是我的一切！,最后再给你一个忠告。\n如果遇到摘下面具的家伙，\n那一定是“结社”的干部，千万要小心。\n哼……当然，这么说是为了\n不让你卷入我和“结社”的仇怨……,原来如此……刚才真是对不住了，\n让你陪我演这出无聊的闹剧。\n闲聊到此为止。\n戴上你那令人厌恶的面具吧！\n让你见识见识，被诅咒的“龙锁”之力！,10000,1,300,150,0
40030009,遥远的灵峰,3,2,11,76,3,20,400014,1,110020401,110020402,110020403,0,0,0,0,0,0,AMULET_ARTIST_40030009,麒麟族……\n自古以来，便毫无间断地\n将神秘技艺传承至今的一族。\n他们拥有着流传下来的、\n令人难以想象的技术。 ,追寻麒麟族的传说翻山越岭，\n不知过去了多少个日夜。\n别说找到一丝痕迹，\n就连归路都已无从知晓。,不行了……就在我快放弃的时候，\n阳光倾泻而下，驱散迷雾。\n展现在眼前的是，\n屹立于峻峭山峦之上的美丽都城。,啊，在那里。那座山的前方。\n终于找到了，云雾缭绕的那座城。\n浮于山间，五光十色的神秘城堡。\n我忘记了疲劳，加快脚步，伸出了手……,就在那时，看似触手可及的都市\n突然消失了。\n刚才的一切都是幻觉吗？\n啊，遥远的都城，遥远的——麒麟族。,10000,1,300,150,0
40030010,森林与湖水的歌声,3,2,11,76,3,20,400015,1,110020901,110020902,110020903,0,0,0,0,0,0,AMULET_ARTIST_40030010,追逐猎物的过程中，\n我在迷雾森林迷了路。\n正当我不知所措时，\n耳边传来了动人的歌声。\n循着歌声，我来到了美丽的湖边。,在这一带的猎人之间，\n迷雾森林经常成为话题。\n甚至还有被神秘力量迷惑的传言。\n这歌声难道也是那种东西吗？,我茫然地站在湖边，回过神来已经日落。\n夜晚的森林很危险……\n不过只要留在这里就没问题了吧？\n就在我犹豫之时，\n绽放出美丽光芒的湖面映入眼帘。,在歌唱——\n树木、花朵、湖水，整个森林都在歌唱。\n传入耳中的，是森林和湖水的歌声。\n这大概是迷雾森林\n给予迷失方向的我的温柔。,迷雾森林……\n有不少令人毛骨悚然的传闻，\n也有人说它是沉睡的神秘森林。\n今天，我邂逅了那份神秘。,10000,1,300,150,0
40030011,龙的卧榻,3,3,10,71,3,25,400016,1,110220002,165,110220003,0,0,0,0,0,0,AMULET_ARTIST_40030011,什么？走在森林里，\n发现了有个地方倒了很多树？\n哈哈，你呀……\n那是“龙的卧榻”啊。,什么？这一带有龙吗？\n当然了。不然哪有那么大的卧榻……\n噗噗噗……啊哈哈！\n抱歉抱歉，所谓龙的卧榻，\n只是这里的迷信而已。,这一带哪有什么龙。\n你看到的所谓“龙的卧榻”，\n只是其他野兽把树折断了而已。\n什么？你说你真的看到过龙！？,你说你看到过龙？此话当真？\n哈哈……我奶奶那一辈人\n倒是经常听到龙出没的传言，\n看来那些传言是真的啊。,你看到的那片空地，\n也许真的是“龙的卧榻”吧。\n相传有龙栖息的森林里，\n生物都能茁壮成长。\n多谢你带来好消息！,10000,1,300,150,0
40030012,武术秘笈,3,3,10,71,3,25,400017,1,110010402,110010403,110010404,0,0,0,0,0,0,AMULET_ARTIST_40030012,～卷之一～\n君欲修其武而必熟其兵。\n复以二十载而武艺自达，\n遂自可不战而屈人之兵。,～卷之二～\n胜不在巧技而在其熟，\n复拙技以无寸疏则熟，\n无寸疏熟拙技者强也。,～卷之三～\n胜皆以一技而非百技。\n身百技而知取孰者败，\n身百技而知舍孰者胜。,～卷之四～\n兵之强者，熟兵也，\n兵之霸者，己兵也，\n兵之极者，无兵也。,～卷之秘～\n卷之秘，始也。\n是故完卷如知其道，\n自积跬步而成千里。,10000,1,300,150,0
40030013,铁骑之盾,3,2,11,76,3,20,400018,1,210001702,210001703,210001704,0,0,0,0,0,0,AMULET_ARTIST_40030013,无论有多少道城门、多厚的城墙，\n最终保护人们的还是忠诚的士兵！\n坚不可摧！铜墙铁壁！\n我们是——阿尔贝里亚铁骑兵团！,我们的盾，是王之盾，是民之盾，是国之盾。\n只要有我们在，就不会让任何人受到伤害！\n坚守要塞！勇猛奋战！\n守护吧——阿尔贝里亚铁骑兵团！,没骑着马的骑兵很奇怪？\n那些言辞不会让我们动摇！\n荒谬绝伦！无需多言！\n出发吧——阿尔贝里亚铁骑兵团！,重要的是坚实的肉体与强韧的精神！\n美味的食物因此不可或缺！\n大块朵硕！饕餮盛宴！\n这正是——阿尔贝里亚铁骑兵团！,我们不要战功，也不要勋章。\n我们甘愿成为战壕，守护民众！\n坚韧不拔！一心一意！\n这才是——阿尔贝里亚铁骑兵团！,10000,1,300,150,0
40030014,圣罗塔斯之风,3,4,10,73,3,23,400019,1,110100002,110100003,110100004,0,0,0,0,0,0,AMULET_ARTIST_40030014,圣罗塔斯之风——\n即水上都市圣罗塔斯\n刮起的格外强劲的风。\n圣罗塔斯也因此\n经常遭遇风灾。,圣罗塔斯之风，还常伴随着水灾。\n一旦引发一种叫做宏伟巨浪的潮水，\n城中的广场也会被淹没。,圣罗塔斯的历史，\n是一部与大自然的抗争史。\n人们从不向灾害低头，\n不断建设新的防波堤和泄洪渠。\n圣罗塔斯就这样逐渐发展壮大。,圣罗塔斯之风，\n同时也是带来生命的气息的恩惠之风。\n在圣塔罗斯，\n流传着婴儿会乘着风到来的传说。,被圣塔罗斯之风带到这里\n而得救的水手不计其数。\n圣塔罗斯之风，\n并不是只会带来灾害的不祥之风，\n而是拯救苍生的恩宠之风。,10000,1,300,150,0
40030015,香薰灯,3,2,11,76,3,20,400020,1,110020201,110020202,110020203,0,0,0,0,0,0,AMULET_ARTIST_40030015,哎呀，你看起来很疲劳呢。\n来得正好，\n我正准备开始香薰呢。\n要不要一起来啊？,往里面倒上精油，点上蜡烛……\n好啦，准备完毕。\n好好享受美妙的芳香吧。\n而且……香薰的乐趣，\n可不只有香气哦。,怎么样，很漂亮的烛光吧？\n享受香薰的同时一饱眼福，\n这也是香薰灯的魅力之一。,请好好放松一下身体。\n别逞强了，说什么自己不累\n这种一眼就能看穿的谎话。\n好了，快来这边吧。,还有很多种类的香薰精油哦。\n缓解疲劳的话用茉莉花或者薰衣草，\n如果睡不着的话……\n哎呀？呵呵，好像已经睡着了。\n香薰的魅力，请在梦里继续享受吧。,10000,1,300,150,0
40030016,八叶草,3,1,10,71,3,25,400021,1,110390002,110390003,110390005,0,0,0,0,0,0,AMULET_ARTIST_40030016,妈妈，妈妈。\n今天我找到了八片叶子的幸运草。\n比起四叶草，更能带来幸福哦！\n可是，我不小心摔倒弄丢了……,嗯？口袋里怎么有片八叶草？\n什么时候掉进来的……\n幸福的象征……虽然带着也不错，\n可惜跟我这野蛮佣兵不太配啊。\n去吧，飞到更合适的家伙那里去吧！,哇，这是什么！八叶草？\n也就是说充满了幸福吗！？\n啊，对了！献给我心爱的他！\n这样我们就能\n一起登上幸福的阶梯啦！,要把这八叶草送给我？\n谢谢，我很开心。\n但是……刚才我看到有一个小女孩，\n因为弄丢了八叶草而嚎啕大哭。\n如果你不介意，就给那个孩子吧……,妈妈，妈妈！\n八叶草又回来了！\n幸运会降临原来是真的啊！\n给，八叶草送给妈妈。\n这样大家就都幸福了！,10000,1,300,150,0
40030017,禁忌的遗物,3,3,10,71,3,25,400022,1,110360002,110360003,110360004,0,0,0,0,0,0,AMULET_ARTIST_40030017,相传很久很久以前，\n比神话时代还要更久远的过去，\n曾出现过机械文明的时代。\n据说这个齿轮就是那个时代的遗物。,机械文明触到了龙的逆鳞。\n对于尊崇大自然的龙来说，\n决不允许机械文明\n扰乱自然法则。,最终人们还是选择服从龙。\n面对文明所带来的空前灾祸，\n人与龙选择了合作。,相传灾祸将人类、龙、世界……\n所有的一切都破坏殆尽。\n而人类对于毁灭世界的文明，\n以及创造出文明的自己感到了恐惧。,文明被当作禁忌封印了起来。\n然而文明是人的欲望所带来的产物。\n人的欲望终将导致发展，催生文明。\n或许人类会再次打开潘多拉的魔盒，\n或许有人将再次转动禁忌的齿轮……,10000,1,300,150,0
40030018,勇士们的追梦痕迹,3,1,10,71,3,25,400023,1,210000802,210000803,210000804,0,0,0,0,0,0,AMULET_ARTIST_40030018,《勿忘塞洛迪恩》——\n塞洛迪恩平原上，矗立着一座碑。\n记录了早在阿尔贝里亚之前的时代，\n这片大地所上发生的战争。,那是既没有王，也没有国家的乱世。\n武将们分裂为无数阵营，互相争斗。\n一个只考虑着如何打败他人的\n冷酷无情的时代。,塞洛迪恩平原之战，\n起初只是4名武将之间势均力敌的战争。\n然而翌日又有5名武将参战。\n三天后参战武将已经多达23名。\n此时，战争最初的目的早已被遗忘……,参战者中，死伤者超过八成。\n即便如此，惨烈的战斗依旧不分胜负。\n他们所追求的结果是什么，\n所追寻的梦想又是什么，\n没有人能够回答。,“勿忘塞洛迪恩。\n勇士们追梦的末路到底留下了什么？\n追逐的梦想，渴望的未来？\n不，只剩下了腐朽的尸骸。\n愿不再出现立剑于此之人。”,10000,1,300,150,0
40030019,《古里摩鲁丝·德古斯》抄本,3,1,10,71,3,25,400024,1,110060002,110060003,110060004,0,0,0,0,0,0,AMULET_ARTIST_40030019,我开始挑战破解失传的\n异端魔道书——《古里摩鲁丝·德古斯》。\n魔法研究者们研究着仅存的抄本，\n但收获甚微。\n正因如此，我感受到了破解的价值……,“Sebudd”……是“叫喊”的意思吗？\n“Hauz”意思是“声音”。是指“呼唤”吗？\n那这句是说“倾听来自海底的呼唤”？\n不不不，“Hyutebb Zerra”不能直译，\n也许还有什么其它意思。,通过破译《古里摩鲁丝·德古斯》能确定的是，\n这本魔道书更像是一本宗教书籍。\n时不时就会出现崇拜某人的词句。\n“Zozetta Bowda”……“遥远之主”。\n赞颂“遥远之主”吧……,啊……原来如此，原来如此！\n“Nyarlathotep”既是名称又是咒文。\n是解开秘密的金钥匙！\n咏唱吧，啊——遥远的引路者。\n咏唱吧，Nyarlathotep！,《古里摩鲁丝·德古斯》的破译\n之所以一筹莫展，\n是因为研究者大多都疯了……\n当我意shi到这是一本绝dui不能\n碰触的禁忌魔道书时……（字迹无法解读）,10000,1,300,150,0
40030020,暗夜的宣告,3,1,10,71,3,25,400025,1,210000302,210000303,210000304,0,0,0,0,0,0,AMULET_ARTIST_40030020,弗洛里德尔——翱翔于夜空的鹰。\n人们将它视为不详之兆。\n“弗洛里德尔飞翔的夜晚，便会有人死去。”\n这一传言广为流传。,弗洛里德尔——翱翔于夜空的鹰。\n人们将它视为不详之兆。\n“将有人死去”这并不是流言蜚语。\n弗洛里德尔是向暗杀者\n传达通知的不祥信使。,弗洛里德尔——翱翔于夜空的鹰。\n人们将它视为不详之兆。\n当它展翅高飞，刺客便开始活动，\n奔走于暗夜之中。\n于是，又将有一个生命陨落。,弗洛里德尔——翱翔于夜空的鹰。\n人们将它视为不详之兆。\n今夜，又将有人殒命。\n然而真正令人恐惧的，是鹰，还是人？\n月光下它的身躯，庄严而肃穆。,弗洛里德尔——翱翔于夜空的鹰。\n人们将它视为不详之兆。\n弗洛里德尔宣告之人必将死去，\n而后弗洛里德尔将指引灵魂\n回归魔力循环。,10000,1,300,150,0
40030021,通往明天的车辙,3,2,11,76,3,20,400026,1,110020601,110020602,110020603,0,0,0,0,0,0,AMULET_ARTIST_40030021,我迈着沉重的脚步，行走在草原上。\n离开故乡、一心想在王都索尔·阿尔贝里亚\n闯出一片天的我，却在途中迷失了方向。\n只能祈祷这地上的车辙\n能顺利将我带向王都。,在王都，我得到了行商的工作，\n开始了前往罗布雷尔的旅途。\n途中遭遇魔兽的袭击，\n回过神来我又在沿着车辙走。\n这样真的能到达罗布雷尔吗？,渐渐开始觉得行商的日子也不错。\n从湖边的村落进货，然后前往下一个城镇。\n沿着不知是谁留下的车辙，走在艰险的路上。\n仅仅是看到有车辙在，心里就会觉得踏实。\n真是不可思议。,啊……一切都完了……\n货物都被山贼夺走了。\n商品和契约书，什么都没了。\n说不定横尸在这片荒野还能轻松一些。\n尽管这样想着，我的双腿仍循着车辙。,坐在驶向王都的马车上，\n回想起了刚开始行商的那段时光。\n在孤独的旅途中，\n地面上留下的车辙成了通向希望的路。\n如今我的车辙也会成为他人的希望吗？,10000,1,300,150,0
